pk_id_altmetrics_info;version;date_from;date_to;id;"title";"journal_title";"author";publication_date;"doi";"detail_url"
599;1;1900-01-01 00:00:00;2199-12-31 23:59:59;599;"Where food safety meets nutrition outcomes in livestock and fish value chains: a conceptual approach";"Food Security";"Häsler, B., Dominguez-Salas, P., Fornace, K., Garza, M., Grace, D. and Rushton, J.";2017-01-01 00:00:00;"10.1007/s12571-017-0710-2";"https://www.altmetric.com/details/24988790"
600;1;1900-01-01 00:00:00;2199-12-31 23:59:59;600;"What we know about gender and rural climate services: Preliminary findings and guidance";;"Rose, Alison; Huyer, Sophia; van Huysen, Tiff; Hansen, James; Vaughan, Cathy";2017-11-16 00:00:00;;"https://www.altmetric.com/details/29082053"
601;1;1900-01-01 00:00:00;2199-12-31 23:59:59;601;"Wastewater: the untapped resource";;"United Nations World Water Assessment Programme";2017-01-01 00:00:00;;"https://www.altmetric.com/details/44626306"
602;1;1900-01-01 00:00:00;2199-12-31 23:59:59;602;"Wastewater for greening the desert";;"CGIAR Research Program on Water, Land and Ecosystems; International Water Management Institute";2017-01-01 00:00:00;;"https://www.altmetric.com/details/23654934"
603;1;1900-01-01 00:00:00;2199-12-31 23:59:59;603;"Variable Returns to Fertiliser Use and the Geography of Poverty: Experimental and Simulation Evidence from Malawi";"IFPRI Knowledge Repository";"Harou, Aurélie P.; Barrett, Christopher B.; Liu, Yanyan; You, Liangzhi";2017-01-01 00:00:00;"10.1093/jae/ejx002";"https://www.altmetric.com/details/19782043"
604;1;1900-01-01 00:00:00;2199-12-31 23:59:59;604;"Validity of gestational age estimates by last menstrual period and neonatal examination compared to ultrasound in Vietnam";"BMC Pregnancy and Childbirth";"Ramakrishnan, Usha; Martorell, Reynaldo; Nguyen, Son; Neufeld, Lynnette; Nguyen, Phuong H.; Pham, Hoa; Deputy, Nicholas P.";2017-01-11 00:00:00;"10.1186/s12884-016-1192-5";"https://www.altmetric.com/details/15409341"
605;1;1900-01-01 00:00:00;2199-12-31 23:59:59;605;"Validity and Reproducibility of a Food Frequency Questionnaire for Dietary Factors Related to Colorectal Cancer";"Nutrients";"Van Camp, John; Huybrechts, Inge; Van Loco, Joris; Huybregts, Lieven; Tollosa, Daniel Nigusse";2017-11-17 00:00:00;"10.3390/nu9111257";"https://www.altmetric.com/details/29492392"
606;1;1900-01-01 00:00:00;2199-12-31 23:59:59;606;"Unlocking the farming potential in Bangladesh’ polders.";;"CGIAR Research Program on Water, Land and Ecosystems (WLE)";2017-01-01 00:00:00;;"https://www.altmetric.com/details/22002817"
607;1;1900-01-01 00:00:00;2199-12-31 23:59:59;607;"Unconditional Seasonal Cash Transfer Increases Intake of High-Nutritional-Value Foods in Young Burkinabe Children: Results of 24-Hour Dietary Recall Surveys within the MAM’Out Randomized Controlled Trial";"Journal of Nutrition";"Tonguet-Papucci, Audrey; Houngbe, Freddy; Huybregts, Lieven; Aït-Aïssa, Myriam; Altare, Chiara; Kolsteren, Patrick; and Huneau, Jean-François.";2017-06-02 00:00:00;"10.3945/jn.116.244517";"https://www.altmetric.com/details/20737930"
608;1;1900-01-01 00:00:00;2199-12-31 23:59:59;608;"Uncertainty in smallholder milk production in Tanzania: Implications for investment";;"Omore, Amos; Githinji, J.; Twine, Edgar";2017-12-15 00:00:00;;"https://www.altmetric.com/details/30376651"
609;1;1900-01-01 00:00:00;2199-12-31 23:59:59;609;"Una innovación en el manejo del pastoreo como estrategia para mejorar la producción animal y reducir las emisiones de GEI";;"Giraldo, Luis; Zubieta, Angel; Carvalho, Paulo; Chirinda, Ngonidzashe; Arango, Jacobo; Marin, Alejandra; Baldissera, Tiago; Garagorry, Fabio; Pinto, Cassiano";2017-12-18 00:00:00;;"https://www.altmetric.com/details/30825839"
610;1;1900-01-01 00:00:00;2199-12-31 23:59:59;610;"Training in development and use of Growing Season Onset and Downscaled Seasonal Forecast Maprooms, Kigali, Rwanda, March 2017";;"Rose, Alison; del Corral, John";2017-03-31 00:00:00;;"https://www.altmetric.com/details/20317893"
611;1;1900-01-01 00:00:00;2199-12-31 23:59:59;611;"Towards Climate-Smart Agriculture in Southeast Asia: Initial results in Ma Village, Vietnam";;"Hoang, Thi Lua; Vernooy, Ronnie";2017-04-07 00:00:00;;"https://www.altmetric.com/details/18743214"
612;1;1900-01-01 00:00:00;2199-12-31 23:59:59;612;"Time series analysis based on two-part models for excessive zero count data to detect farm-level outbreaks of swine echinococcosis during meat inspections";"Preventive Veterinary Medicine";"Adachi, Y. and Makita, K.";2017-10-01 00:00:00;"10.1016/j.prevetmed.2017.10.001";"https://www.altmetric.com/details/27476606"
613;1;1900-01-01 00:00:00;2199-12-31 23:59:59;613;"The socioeconomic impacts of large-scale tree plantations on local communities: A systematic review protocol";;"Pirard, Romain; Zhou, Wen";2017-01-01 00:00:00;"10.17528/cifor/006406";"https://www.altmetric.com/details/17810271"
614;1;1900-01-01 00:00:00;2199-12-31 23:59:59;614;"The socioeconomic determinants of legal and illegal smallholder logging: Evidence from the Ecuadorian Amazon";"Forest Policy & Economics";"Vasco, C., Torres, B., Pacheco, P., Griess, V.";2017-05-01 00:00:00;"10.1016/j.forpol.2017.01.015";"https://www.altmetric.com/details/16341402"
615;1;1900-01-01 00:00:00;2199-12-31 23:59:59;615;"The Shade Tree Advice Tool";;"Asare, Richard; van der Wolf, Just; Gram, Gil; Giller, Onno; Vaast, Philippe; Kirabo, Enoch; Bukomeko, Hannington; Jassogne, Laurence; Mukasa, David; Angebault, Charles";2017-03-22 00:00:00;;"https://www.altmetric.com/details/22157474"
616;1;1900-01-01 00:00:00;2199-12-31 23:59:59;616;"The public and private regime complex for governing palm oil supply";;"Komarudin, Heru; Schoneveld, George; Pacheco, Pablo; Dermawan, Ahmad";2017-01-01 00:00:00;"10.17528/cifor/006464";"https://www.altmetric.com/details/20145480"
617;1;1900-01-01 00:00:00;2199-12-31 23:59:59;617;"The Promotion of Climate-Smart Villages to Support Community-Based Adaptation Programming in Myanmar";;"Vidallo, Rene; Barbon, Wilson John; Gonsalves, Julian";2017-09-07 00:00:00;;"https://www.altmetric.com/details/24988786"
618;1;1900-01-01 00:00:00;2199-12-31 23:59:59;618;"The impact of insecticide-treated material to reduce flies among pork outlets in Kampala, Uganda";"Parasitology Research";"Grace, D.; Clausen, Peter-Henning; Roesel, Kristina; Heilmann, M.; Bauer, Burkhard";2017-06-15 00:00:00;"10.1007/s00436-017-5450-x";"https://www.altmetric.com/details/20304274"
619;1;1900-01-01 00:00:00;2199-12-31 23:59:59;619;"The GreenSeeker Handheld: A Research Brief on Farmer Technology Adoption and Disadoption";;"Ortiz Monasterio, Ivan; Ca?rdenas Castan?eda, Mari?a Elena; Lapidus, Daniel; Beach, Robert; Latane?, Annah";2017-09-12 00:00:00;"10.3768/rtipress.2017.rb.0014.1705";"https://www.altmetric.com/details/25333724"
620;1;1900-01-01 00:00:00;2199-12-31 23:59:59;620;"The effect of inflammation on serum zinc concentrations and the prevalence estimates of population-level zinc status among Congolese children aged 6–59 months";"European Journal of Clinical Nutrition";"Barr, Susan I.; Houghton, Lisa A.; Tugirimana, Pierrot L.; Bahizire, Esto; Green, Tim J.; Akilimali, Pierre Z.; Boy, Erick; Karakochuk, Crystal D.";2017-08-23 00:00:00;"10.1038/ejcn.2017.127";"https://www.altmetric.com/details/24262578"
621;1;1900-01-01 00:00:00;2199-12-31 23:59:59;621;"The development and release of maize fortified with provitamin A carotenoids in developing countries";"Critical Reviews in Food Science and Nutrition";"Manjeru, P., Van Biljon, A., & Labuschagne, M.";2017-12-04 00:00:00;"10.1080/10408398.2017.1402751";"https://www.altmetric.com/details/30022127"
622;1;1900-01-01 00:00:00;2199-12-31 23:59:59;622;"Tariffs, Smuggling and Economic Welfare: A Spatial Analysis of Nigerian Rice Policy Options";"Journal of African Economies";"Dorosh, Paul A.; Johnson, Michael E.";2017-08-01 00:00:00;"10.1093/jae/ejx008";"https://www.altmetric.com/details/24862592"
623;1;1900-01-01 00:00:00;2199-12-31 23:59:59;623;"Targeting agricultural innovations and ecosystem services in the Volta Basin";;"CGIAR Research Program on Water, Land and Ecosystems (WLE).";2017-01-01 00:00:00;;"https://www.altmetric.com/details/24060336"
624;1;1900-01-01 00:00:00;2199-12-31 23:59:59;624;"Tagasaste (Chamaecytisus palmensis) leaf supplementation to enhance nutrient intake and production performance of sheep in the Ethiopian highlands";"Tropical Animal Health & Production";"Mekonnen, Kindu; Duncan, Alan J.; Adie, Aberra; Tolera, A.; Bezabih, Melkamu; Thorne, Peter J.; Mengesha, M.";2017-01-01 00:00:00;"10.1007/s11250-017-1342-4";"https://www.altmetric.com/details/23456716"
625;1;1900-01-01 00:00:00;2199-12-31 23:59:59;625;"Suitable Hybrids and Synthetics Provitamin A Maize Selected for Release in the Democratic Republic of Congo";"Open Access Library Journal";"Kasongo, Kaboko; Badibanga, Mulumba; Vumilia, Kizungu; Jadika, Tshimbombo; Tshiabukole, Kabongo; Khonde, Pongi; Kankolongo, Mbuya; Kasongo, Tshibanda";2017-10-11 00:00:00;"10.4236/oalib.1103446";"https://www.altmetric.com/details/28271621"
626;1;1900-01-01 00:00:00;2199-12-31 23:59:59;626;"Subsidy-free community-based composting";;"CGIAR Research Program on Water, Land and Ecosystems; International Water Management Institute";2017-01-01 00:00:00;;"https://www.altmetric.com/details/23654897"
627;1;1900-01-01 00:00:00;2199-12-31 23:59:59;627;"State of knowledge: River health in the Salween";;"Taylker, L.; Ketelsen, T.; Ko Ko Gyi, M.; Aung, T.; McCartney, M.; Ma Ma Gyi, Khin; Liu, S.; Johnston, R.; Vinh, M.K.";2017-01-01 00:00:00;;"https://www.altmetric.com/details/23456706"
628;1;1900-01-01 00:00:00;2199-12-31 23:59:59;628;"State of knowledge: River health in the Ayeyarwady";;"Liu, Shaoyu,; Ketelsen, T.; Hunter, R.; Charles, M.; Vinh, Mai Ky; Johnston, R.; Taylor, L.; Khin, Ma Ma Gyi; Kyaw, Tint";2017-01-01 00:00:00;;"https://www.altmetric.com/details/23456705"
629;1;1900-01-01 00:00:00;2199-12-31 23:59:59;629;"State of Knowledge: Hydropower Environmental Mitigation Measures on the Lancang River";;"Yu, Xuezhong; Geheb, Kim";2017-07-01 00:00:00;;"https://www.altmetric.com/details/29872188"
630;1;1900-01-01 00:00:00;2199-12-31 23:59:59;630;"Spatial variability of soil N2 O and CO2 fluxes in different topographic positions in a tropical montane forest in Kenya.";"JOURNAL OF GEOPHYSICAL RESEARCH: BIOGEOSCIENCES";"Rufino, Mariana C.; Diaz-Pines, Eugenio; Verchot, Louis; Arias-Navarro, Cristina; Butterbach-Bahl, Klaus; Klatt, Steffen; Brandt, Patric";2017-02-27 00:00:00;"10.1002/2016jg003667";"https://www.altmetric.com/details/18147619"
631;1;1900-01-01 00:00:00;2199-12-31 23:59:59;631;"Spatial dynamics of porcine epidemic diarrhea (PED) spread in the southern Kyushu, Japan";"Preventive Veterinary Medicine";"Sasaki, Y., Toyomaki, H., Sekiguchi, S., Sueyoshi, M., Makita, K., Otake, S., Perez, A. and Alvarez, J.";2017-09-01 00:00:00;"10.1016/j.prevetmed.2017.05.025";"https://www.altmetric.com/details/32590772"
632;1;1900-01-01 00:00:00;2199-12-31 23:59:59;632;"Soil and water managements and landscapes: Africa RISING science, innovations and technologies with scaling potential from the Ethiopian highlands";;"Yaekob, T.; Mekonnen, Kindu; Gebrekirstos, Aster; Schmitter, Petra S.; Haileslassie, Amare; Adimassu, Zenebe; Hagos, Fitsum; Gurmessa, Biyensa; Woldearegay, K.; Tamene, Lulseged";2017-01-17 00:00:00;;"https://www.altmetric.com/details/16675568"
633;1;1900-01-01 00:00:00;2199-12-31 23:59:59;633;"Sharing benefits of hydropower at the local level will expedite energy and water resources development in Uttarakhand";;"CGIAR Research Program on Water, Land and Ecosystems";2017-01-01 00:00:00;;"https://www.altmetric.com/details/30825847"
634;1;1900-01-01 00:00:00;2199-12-31 23:59:59;634;"Service d’Information Climatique pour Accroitre la Résilience et la Productivité au Sénégal";;"Diouf, Seynabou; Oue?draogo, Issa";2017-01-15 00:00:00;;"https://www.altmetric.com/details/23116719"
635;1;1900-01-01 00:00:00;2199-12-31 23:59:59;635;"Sensory evaluation of provitamin A carotenoid-rich banana cultivars on trial for potential adoption in Burundi and Eastern Democratic Republic of Congo";"Fruits";"Ekesa, B., Nabuuma, D., Kennedy, G., Van den Bergh, I.";2017-10-01 00:00:00;"10.17660/th2017/72.5.1";"https://www.altmetric.com/details/27369607"
636;1;1900-01-01 00:00:00;2199-12-31 23:59:59;636;"Seasonality affects dietary diversity of school-age children in northern Ghana";"PLoS ONE";"Abizari, Abdul-Razak, Fusta Azupogo, Miwako Nagasu, Noortje Creemers, and Inge D. Brouwer.";2017-01-01 00:00:00;"10.1371/journal.pone.0183206";"https://www.altmetric.com/details/23844868"
637;1;1900-01-01 00:00:00;2199-12-31 23:59:59;637;"Risk factors for rotavirus infection in pigs in Busia and Teso subcounties, Western Kenya";"Tropical Animal Health & Production";"Mimo, J.O., Otieno, T.F., Okoth, E., Onono, J.O. and Bett, B.";2017-01-01 00:00:00;"10.1007/s11250-016-1164-9";"https://www.altmetric.com/details/22047133"
638;1;1900-01-01 00:00:00;2199-12-31 23:59:59;638;"Reviving Springs: An eight step methodology";;"Mukerji, Aditi";2017-12-01 00:00:00;;"https://www.altmetric.com/details/17215590"
639;1;1900-01-01 00:00:00;2199-12-31 23:59:59;639;"Reviving Springs in the Mid-hills, and Promoting Solar Pumps in the Terai, Nepal";;"CGIAR Research Program on Water, Land and Ecosystems (WLE)";2017-01-01 00:00:00;;"https://www.altmetric.com/details/22056605"
640;1;1900-01-01 00:00:00;2199-12-31 23:59:59;640;"Review of Index-Based Insurance for Climate-Smart Agriculture: Improving climate risk transfer and management for Climate-Smart Agriculture — A review of existing examples of successful index-based insurance for scaling up";;"Shaw, Rebecca; Rüegg, Mark; Hellin, Jon; Greatrex, Helen; Diro, Rahel; Zougmore, Robert B.; Cuellar, Daniela; Aggarwal, Pramod; Adegoke, Jimmy; Hansen, James";2017-10-01 00:00:00;;"https://www.altmetric.com/details/33003160"
641;1;1900-01-01 00:00:00;2199-12-31 23:59:59;641;"Retos y oportunidades para el desarrollo de la NAMA Ganadería en Colombia y Costa Rica";;"Chirinda, Ngonidzashe; Tapasco, Jeimar; Segura, Jorge; Chacon, Mauricio; Serna, Laura; Arango, Jacobo; Escobar, Daniel; Villanueva, Cristobal";2017-02-09 00:00:00;;"https://www.altmetric.com/details/22138388"
642;1;1900-01-01 00:00:00;2199-12-31 23:59:59;642;"Resumen de insumos y consideraciones clave para la Actualización de la Política Pública “Por la Dignidad de las Mujeres en el Cauca”.";;"Muriel, Juliana; Twyman, Jennifer; Martinez Baron, Deissy; Gumucio, Tatiana; Tafur, Mariana";2017-12-15 00:00:00;;"https://www.altmetric.com/details/40716572"
643;1;1900-01-01 00:00:00;2199-12-31 23:59:59;643;"Redesigning Delivery: Boosting Adoption of Coffee Management Practices in Uganda. The climate smart investment pathway approach and the farmer segmentation tool";;"Giller, Onno; Kemigisha, Elizabeth; Bukomeko, Hannington; Asten, Piet Van; Jassogne, Laurence; Mukasa, David; Kirungi, Diana";2017-04-19 00:00:00;;"https://www.altmetric.com/details/21882000"
644;1;1900-01-01 00:00:00;2199-12-31 23:59:59;644;"Re-operating large dams to benefit all -- experiences from Akosombo and Kpong dams in Ghana";;"Mul, Marloes L.";2017-01-01 00:00:00;;"https://www.altmetric.com/details/27425097"
645;1;1900-01-01 00:00:00;2199-12-31 23:59:59;645;"Re-conceptualizing  dam design  and  management  for  enhanced  water  and food  security";;"CGIAR Research Program on Water, Land and Ecosystems";2017-01-01 00:00:00;;"https://www.altmetric.com/details/23654906"
646;1;1900-01-01 00:00:00;2199-12-31 23:59:59;646;"Provitamin A-biofortified maize consumption increases serum xanthophylls and 13C-natural abundance of retinol in Zambian children";"Experimental Biology and Medicine";"Sheftel, J; Gannon, BM; Tanumihardjo, SA; Davis, CR";2017-09-01 00:00:00;"10.1177/1535370217728500";"https://www.altmetric.com/details/24297728"
647;1;1900-01-01 00:00:00;2199-12-31 23:59:59;647;"Producing briquettes from municipal solid waste";;"CGIAR Research Program on Water, Land and Ecosystems; International Water Management Institute";2017-01-01 00:00:00;;"https://www.altmetric.com/details/23654913"
648;1;1900-01-01 00:00:00;2199-12-31 23:59:59;648;"Producing briquettes from agro-waste";;"CGIAR Research Program on Water, Land and Ecosystems; International Water Management Institute";2017-01-01 00:00:00;;"https://www.altmetric.com/details/23654928"
649;1;1900-01-01 00:00:00;2199-12-31 23:59:59;649;"Producing biogas from kitchen waste";;"International Water Management Institute";2017-01-01 00:00:00;;"https://www.altmetric.com/details/23654904"
650;1;1900-01-01 00:00:00;2199-12-31 23:59:59;650;"Producing biogas from fecal sludge at community level";;"CGIAR Research Program on Water, Land and Ecosystems; International Water Management Institute";2017-01-01 00:00:00;;"https://www.altmetric.com/details/23654901"
651;1;1900-01-01 00:00:00;2199-12-31 23:59:59;651;"Producción de carne bovina sostenible bajo asociaciones forrajeras para el trópico americano";;"Gutierrez Solis, Jhon Freddy; Sotelo Cabrera, Mauricio Efren; Peters, Michael; Hincapié Carvajal, Belisario";2017-09-01 00:00:00;;"https://www.altmetric.com/details/31815197"
652;1;1900-01-01 00:00:00;2199-12-31 23:59:59;652;"Preferencias de consumidores y segmentación del mercado para una carne diferenciada con menor impacto ambiental";;"Burkart, Stefan; Enciso, Karen";2017-01-10 00:00:00;;"https://www.altmetric.com/details/28404867"
653;1;1900-01-01 00:00:00;2199-12-31 23:59:59;653;"Predictors of adherence to micronutrient supplementation before and during pregnancy in Vietnam";"BMC Public Health";"Young, Melissa; Nguyen, Hieu; Ramakrishnan, Usha; Gonzalez-Casanova, Ines; Martorell, Reynaldo; Nguyen, Phuong Hong; Nguyen, Son; Truong, Truong V.; Neufeld, Lynnette M.; Nechitillo, Meredith; Reinhart, Gregory A.; Pham, Hoa; Harding, Kimberly B";2017-05-16 00:00:00;"10.1186/s12889-017-4379-4";"https://www.altmetric.com/details/20972351"
654;1;1900-01-01 00:00:00;2199-12-31 23:59:59;654;"Poverty-gender-agriculture nexus in the northern region of Bangladesh: Challenges and Opportunities";;"CGIAR Research Program on Water, Land and Ecosystems (WLE)";2017-01-01 00:00:00;;"https://www.altmetric.com/details/22065942"
655;1;1900-01-01 00:00:00;2199-12-31 23:59:59;655;"Poverty squares and gender circles: unravelling agriculture gaps, challenges and opportunities in the Eastern Gangetic Plains";;"CGIAR Research Program on Water, Land and Ecosystems";2017-09-01 00:00:00;;"https://www.altmetric.com/details/28756385"
656;1;1900-01-01 00:00:00;2199-12-31 23:59:59;656;"Potential of using host plant resistance, nitrogen and phosphorus fertilizers for reduction of Aspergillus flavuscolonization and aflatoxin accumulation in maize in Tanzania";"Crop Protection";"Manoza, F.S., Mushongi, A.A., Harvey, J., Wainaina, J., Wanjuki, I., Ngeno, R., Darnell, R., Gnonlonfin, B.G.J. and Massomo, S.M.S.";2017-03-01 00:00:00;"10.1016/j.cropro.2016.11.021";"https://www.altmetric.com/details/14524523"
657;1;1900-01-01 00:00:00;2199-12-31 23:59:59;657;"Policy Effectiveness of Loan for Delaying Timber Harvesting for Smallholder Private Forest in Indonesia";"Jurnal Manajemen Hutan Tropika";"Nugroho, B., Soedomo, S., Dermawan, A.";2017-08-31 00:00:00;"10.7226/jtfm.23.2.61";"https://www.altmetric.com/details/32020104"
658;1;1900-01-01 00:00:00;2199-12-31 23:59:59;658;"Platforms for institutional change: assessing the potential of livelihood enhancement groups as community entry points in Zambia";"Development in Practice";"Mulungu, K., Madzudzo, E., Adjei-Nsiah, S., Akatama, M.";2017-08-18 00:00:00;"10.1080/09614524.2017.1340434";"https://www.altmetric.com/details/27163329"
659;1;1900-01-01 00:00:00;2199-12-31 23:59:59;659;"Piloting managed aquifer recharge (MAR) in the central highlands of Vietnam to sustain groundwater supplies for irrigated smallholder coffee production";;"CGIAR Research Program on Water, Land and Ecosystems (WLE)";2017-01-01 00:00:00;;"https://www.altmetric.com/details/20787833"
660;1;1900-01-01 00:00:00;2199-12-31 23:59:59;660;"Photo report of the Training of Trainers on Scaling of Africa RISING Project Validated Technologies/Innovations in the Ethiopian Highlands, Debre Birhan, 16-18 May 2017";;"Habtamu, Apollo";2017-05-18 00:00:00;;"https://www.altmetric.com/details/21636119"
661;1;1900-01-01 00:00:00;2199-12-31 23:59:59;661;"Phosphorous recovery at scale";;"CGIAR Research Program on Water, Land and Ecosystems; International Water Management Institute";2017-01-01 00:00:00;;"https://www.altmetric.com/details/24060343"
662;1;1900-01-01 00:00:00;2199-12-31 23:59:59;662;"Phenotyping Brachiaria genotypes to assess Rhizoctonia resistance by comparing three inoculum types";"Plant Disease";"Sotelo, Guillermo; Hernandez, Luis Miguel; Miles, John; Worthington, Margaret; Álvarez, Elizabeth; Bonilla, Ximena P.";2017-01-01 00:00:00;"10.1094/pdis-08-16-1160-re";"https://www.altmetric.com/details/16111305"
663;1;1900-01-01 00:00:00;2199-12-31 23:59:59;663;"Participatory Integrated Climate Services for Agriculture (PICSA) Specialist Intermediary Training in Nyamata, Rwanda";;"Kagabo, Desire M.; Clarkson, Graham; Dorward, Peter; Nsengiyumva, Gloriose";2017-07-10 00:00:00;;"https://www.altmetric.com/details/21811339"
664;1;1900-01-01 00:00:00;2199-12-31 23:59:59;664;"Participatory diagnosis and development of climate change adaptive capacity in the groundnut basin of Senegal: building a climate-smart village model";"Agriculture & Food Security";"Sanogo, Diaminatou; Ndiaye, Ousmane; Diop, Mouhamadou; Camara, Baba Ansoumana; Ndour, Yacine; Thiam, Djibril; Sall, Moussa; Toure, Katim";2017-05-10 00:00:00;"10.1186/s40066-017-0091-y";"https://www.altmetric.com/details/22101828"
665;1;1900-01-01 00:00:00;2199-12-31 23:59:59;665;"Partially subsidized composting at district level";;"CGIAR Research Program on Water, Land and Ecosystems; International Water Management Institute";2017-01-01 00:00:00;;"https://www.altmetric.com/details/23654896"
666;1;1900-01-01 00:00:00;2199-12-31 23:59:59;666;"Outsourcing fecal sludge treatment to the farm";;"CGIAR Research Program on Water, Land and Ecosystems; International Water Management Institute";2017-01-01 00:00:00;;"https://www.altmetric.com/details/24060334"
667;1;1900-01-01 00:00:00;2199-12-31 23:59:59;667;"Nutrient recovery from own agro-industrial waste";;"CGIAR Research Program on Water, Land and Ecosystems; International Water Management Institute";2017-01-01 00:00:00;;"https://www.altmetric.com/details/23654900"
668;1;1900-01-01 00:00:00;2199-12-31 23:59:59;668;"NTFP harvesters as citizen scientists: Validating traditional and crowdsourced knowledge on seed production of Brazil nut trees in the Peruvian Amazon";"PLoS ONE";"Thomas E., Valdivia, J., Alcazar Caicedo, C., Quaedvlieg, J., Wadt, L.H.O., Corvera, R.";2017-08-24 00:00:00;"10.1371/journal.pone.0183743";"https://www.altmetric.com/details/24271668"
669;1;1900-01-01 00:00:00;2199-12-31 23:59:59;669;"Multi-spectral kernel sorting to reduce aflatoxins and fumonisins in Kenyan maize";"Food Control";"Stasiewicz, M.J., Falade, T.D.O., Mutuma, M., Mutiga, S.K., Harvey, J.J.W., Fox, G., Pearson, T.C., Muthomi, J.W. and Nelson, R.J.";2017-01-01 00:00:00;"10.1016/j.foodcont.2017.02.038";"https://www.altmetric.com/details/17101277"
670;1;1900-01-01 00:00:00;2199-12-31 23:59:59;670;"Monthly food insecurity assessment in rural mkushi district, Zambia: a longitudinal analysis";"BMC Public Health";"Na, M; Caswell, BL; Talegawkar, SA; Palmer, A.";2017-03-16 00:00:00;"10.1186/s12889-017-4176-0";"https://www.altmetric.com/details/19763186"
671;1;1900-01-01 00:00:00;2199-12-31 23:59:59;671;"Monitoring, reporting and verification of greenhouse gas emissions from livestock: current practices and opportunities for improvement";;"Wilkes, Andreas";2017-05-09 00:00:00;;"https://www.altmetric.com/details/22134113"
672;1;1900-01-01 00:00:00;2199-12-31 23:59:59;672;"Methods Proposed to Evaluate the Potential Impact of Climate Change on Food and Nutrition Security in Central America and the Dominican Republic";;"Martínez Barón, Deissy; van Wijk, Mark; Huyer, Sophia; Lavado, Angela; Thomas, Timothy; Cramer, Laura; Thornton, Philip; Loboguerrero, Ana Maria; van Etten, Jacob; Nyasimi, Mary";2017-05-09 00:00:00;;"https://www.altmetric.com/details/20036978"
673;1;1900-01-01 00:00:00;2199-12-31 23:59:59;673;"Mapping reservoirs in the Volta basin";;"Jones, Sarah; van Soesbergen, Arnout; Smedley, David; Mulligan, Mark";2017-01-01 00:00:00;;"https://www.altmetric.com/details/23654921"
674;1;1900-01-01 00:00:00;2199-12-31 23:59:59;674;"Mapping ecosystem services in the Volta basin using Co$ting nature ES assessment model";;"van Soesbergen, Arnout; Mulligan, Mark";2017-01-01 00:00:00;;"https://www.altmetric.com/details/23654914"
675;1;1900-01-01 00:00:00;2199-12-31 23:59:59;675;"Managing aquifer recharge with wastewater";;"CGIAR Research Program on Water, Land and Ecosystems; International Water Management Institute";2017-01-01 00:00:00;;"https://www.altmetric.com/details/24060353"
676;1;1900-01-01 00:00:00;2199-12-31 23:59:59;676;"Livestock: Africa RISING science, innovations and technologies with scaling potential from the Ethiopian Highlands";;"Mekonnen, Kindu; Adie, Aberra; Asfaw, A.; Alene, Temesgen; Bezabih, Melkamu; Dubale, W; Thorne, Peter J.; Ebrahim, M.";2017-01-17 00:00:00;;"https://www.altmetric.com/details/16675565"
677;1;1900-01-01 00:00:00;2199-12-31 23:59:59;677;"Linking smallholder farmers to markets on extensive and intensive margins: Evidence from Nicaragua?";"Food Policy";"Hernandez, Manuel A.; Ebata, Ayako";2017-12-01 00:00:00;"10.1016/j.foodpol.2017.09.003";"https://www.altmetric.com/details/27508279"
