pk_id_altmetrics_info;version;date_from;date_to;id;"title";"journal_title";"author";publication_date;"doi";"detail_url"
836;1;1900-01-01 00:00:00;2199-12-31 23:59:59;836;"Technical Report: Gender situational analysis of the sweetpotato value chain in Central and Eastern Uganda and strategies for gender equity in postharvest innovations.";;"Naziri, D.; Mayanja, Sarah; Mudege, Netsayi";2017-12-01 00:00:00;;"https://www.altmetric.com/details/30825831"
837;1;1900-01-01 00:00:00;2199-12-31 23:59:59;837;"Taxonomic revision and phylogenetic analyses of rubber powdery mildew fungi";"Microbial Pathogenesis";"Liyanage K.K., Khan, S., Brooks, S., Mortimer, P.E., Karunarathna, S.C., Xu, J., Hyde, K.D.";2017-04-01 00:00:00;"10.1016/j.micpath.2017.01.054";"https://www.altmetric.com/details/39871583"
838;1;1900-01-01 00:00:00;2199-12-31 23:59:59;838;"TAI Project - WP4 Workshops report";;"Kizito, F.; Jankowski, F.; Daré, W.; Labeyrie, V.; Antona, M.";2017-01-01 00:00:00;;"https://www.altmetric.com/details/24060332"
839;1;1900-01-01 00:00:00;2199-12-31 23:59:59;839;"Synchrony in the phenologies of fine roots and leaves of Vitellaria paradoxa in different land uses of Burkina Faso";"Agroforestry Systems";"Bazié P., Ky-Dembele, C., Jourdan, C., Roupsard, O., Zombré, G., Bayala, J.";2017-09-27 00:00:00;"10.1007/s10457-017-0135-0";"https://www.altmetric.com/details/30564774"
840;1;1900-01-01 00:00:00;2199-12-31 23:59:59;840;"Sustaining ecosystem services and benefits for custodian farmers through a well-coordinated, in-situ conservation of RTB agrobiodiversity - Planning Workshop (11-13 Nov 2013, Lima, Peru).";;"CGIAR Research Program on Roots, Tubers and Bananas";2017-01-01 00:00:00;;"https://www.altmetric.com/details/31175862"
841;1;1900-01-01 00:00:00;2199-12-31 23:59:59;841;"Sustainable Intensification of Dairy Production Indonesia (SIDPI project)";;"de Vries, Marion";2017-09-15 00:00:00;;"https://www.altmetric.com/details/27125737"
842;1;1900-01-01 00:00:00;2199-12-31 23:59:59;842;"Sustainable intensification (SI) innovations driven by crop ecology: Africa RISING science, innovations and technologies with scaling potential from the Ethiopian Highlands";;"Mekonnen, Kindu; Adie, Aberra; Ahmed, S.; Bezabih, Melkamu; Thorne, Peter J.";2017-01-17 00:00:00;;"https://www.altmetric.com/details/21921391"
843;1;1900-01-01 00:00:00;2199-12-31 23:59:59;843;"Sustainable financial solutions for the adoption of solar powered irrigation pumps in Nepal’s terai";;"Mukherji, Aditi; Fishman, Ram; Lamichhane, Nabina; Chowdhury, Devjit Roy; Bajracharya, Sugat; Khadgi, Vijay";2017-01-01 00:00:00;;"https://www.altmetric.com/details/22002661"
844;1;1900-01-01 00:00:00;2199-12-31 23:59:59;844;"Support to Agricultural Research for Development of Strategic Crops in Africa Annual Report 2016";;"Support to Agricultural Research for Development of Strategic Crops in Africa";2017-09-01 00:00:00;;"https://www.altmetric.com/details/31175455"
845;1;1900-01-01 00:00:00;2199-12-31 23:59:59;845;"Supervisory Report on CSV Monitoring Plan in the Lawra-Jirapa Climate-Smart Villages, Ghana";;"Nyuor, Anslem B.";2017-11-16 00:00:00;;"https://www.altmetric.com/details/29082068"
846;1;1900-01-01 00:00:00;2199-12-31 23:59:59;846;"Suitability maps for staple crops in south western Uganda";;"CGIAR Research Program on Water, Land and Ecosystems (WLE)";2017-01-01 00:00:00;;"https://www.altmetric.com/details/22160258"
847;1;1900-01-01 00:00:00;2199-12-31 23:59:59;847;"Strategy for defining research priorities.";;"CGIAR Research Program on Roots, Tubers and Bananas";2017-03-01 00:00:00;;"https://www.altmetric.com/details/31175735"
848;1;1900-01-01 00:00:00;2199-12-31 23:59:59;848;"Strategic Assessment of Cassava Research Priorities.";;"CGIAR Research Program on Roots, Tubers and Bananas";2017-01-01 00:00:00;;"https://www.altmetric.com/details/31175832"
849;1;1900-01-01 00:00:00;2199-12-31 23:59:59;849;"Strategic assessment of banana research priorities.";;"CGIAR Research Program on Roots, Tubers and Bananas";2017-01-01 00:00:00;;"https://www.altmetric.com/details/31175823"
850;1;1900-01-01 00:00:00;2199-12-31 23:59:59;850;"Stocks de carbono del suelo en cuatro sistemas de pasturas del trópico seco colombiano";;"Hincapié, Belisario; Vivas, Nelson; Arango, Jacobo; Morales Velasco, Sandra; Gutiérrez, Jhon Freddy; Peters, Michael";2017-10-04 00:00:00;;"https://www.altmetric.com/details/28756392"
851;1;1900-01-01 00:00:00;2199-12-31 23:59:59;851;"Stem breakage and forking in low and high elevation Pinus tecunumanii";"Silvae Genetica";"B. I. Nyoka, P. Tongoona, C. M. Gumbie";2017-08-05 00:00:00;"10.1515/sg-2011-0001";"https://www.altmetric.com/details/39871921"
852;1;1900-01-01 00:00:00;2199-12-31 23:59:59;852;"Stay visual inspection or go weighing? Insights from a value chain analysis for cooking banana in Uganda.";;"Ajambo, Susan; Nowakunda, K.; Naziri, D.; Kikulwe, Enoch; Nalunga, Asha";2017-09-01 00:00:00;;"https://www.altmetric.com/details/31175612"
853;1;1900-01-01 00:00:00;2199-12-31 23:59:59;853;"Status of Cocoyam (Colocasia esculenta and Xanthosoma spp) in West and Central Africa: Production, Household Importance and the Threat from Leaf Blight.";;"CGIAR Research Program on Roots, Tubers and Bananas";2017-01-01 00:00:00;;"https://www.altmetric.com/details/31175782"
854;1;1900-01-01 00:00:00;2199-12-31 23:59:59;854;"State of knowledge: River health in the Salween- Chinese";;"Taylor, Luke; Johnston, Robyn; Mehm, Ko Ko Gyi; McCartney, Matthew; Vinh, Mai Ky; Liu, Shaoyu; Ma Ma Gyi, Khin; Aung, Theiant; Ketelsen, Tarek";2017-01-01 00:00:00;;"https://www.altmetric.com/details/28038447"
855;1;1900-01-01 00:00:00;2199-12-31 23:59:59;855;"State of knowledge: River health in the Salween- Burmese";;"Taylker, L.; Ketelsen, T.; Ko Ko Gyi, M.; Aung Khin, T.; McCartney, M.; Ma Ma Gyi, Khin; Liu, S.; Johnston, R.; Vinh, M.K.";2017-01-01 00:00:00;;"https://www.altmetric.com/details/28038445"
856;1;1900-01-01 00:00:00;2199-12-31 23:59:59;856;"State of knowledge of research in the Guinean forests of West Africa region";"Acta Oecologica";"Luiselli, L., Dendi, D., Eniang, E.A., Fakae, B.B., Akani, G.C., Fa, J.E.";2017-08-01 00:00:00;"10.1016/j.actao.2017.08.006";"https://www.altmetric.com/details/27467488"
857;1;1900-01-01 00:00:00;2199-12-31 23:59:59;857;"Stakeholders’ planning workshop for the Rwanda Climate Services for Agriculture project";;"Munyangeri, Yvonne Uwase; Mungai, Catherine";2017-05-23 00:00:00;;"https://www.altmetric.com/details/20611266"
858;1;1900-01-01 00:00:00;2199-12-31 23:59:59;858;"Southern Ethiopia Agricultural Research Institute gender strategy";;"Ayele, T.";2017-10-23 00:00:00;;"https://www.altmetric.com/details/32590764"
859;1;1900-01-01 00:00:00;2199-12-31 23:59:59;859;"Southern Agricultural Research Institute Gender capacity development action plan performance report - Module 1";;"Ayele, T.";2017-10-23 00:00:00;;"https://www.altmetric.com/details/31977093"
860;1;1900-01-01 00:00:00;2199-12-31 23:59:59;860;"South East Asia Climate-Smart Villages AR4D sites: 2016 Inventory";;"Bonilla-Findji, Osana; Tan Yen, Bui";2017-08-29 00:00:00;;"https://www.altmetric.com/details/24652261"
861;1;1900-01-01 00:00:00;2199-12-31 23:59:59;861;"South Asia Climate-Smart Villages AR4D sites: 2016 Inventory";;"Bonilla-Findji, Osana; Khatri-Chhetri, Arun";2017-08-29 00:00:00;;"https://www.altmetric.com/details/24652265"
862;1;1900-01-01 00:00:00;2199-12-31 23:59:59;862;"Soil respiration in sloping rubber plantations and tropical natural forests in Xishuangbanna, China";"Agriculture, Ecosystems & Environment";"Goldberg S.D., Zhao, Y., Harrison, R.D., Monkai, J., Li, Y., Chau, K., Xu, J.";2017-11-01 00:00:00;"10.1016/j.agee.2017.08.001";"https://www.altmetric.com/details/31951573"
863;1;1900-01-01 00:00:00;2199-12-31 23:59:59;863;"Soil nutrient maps of Sub-Saharan Africa: assessment of soil nutrient content at 250 m spatial resolution using machine learning";;"Tilahun, H.; Mamo, T.; Wheeler, I.; Shepherd, K. D.; Heuvelink, G. B. M.; Fegraus, E.; Berkhout, E.; Leenaars, J. G. B.; Hengl, T.; Walsh, M. G.; Cooper, M.; Kwabena, N. A.";2017-01-01 00:00:00;;"https://www.altmetric.com/details/24060365"
864;1;1900-01-01 00:00:00;2199-12-31 23:59:59;864;"Soil macrofauna as indicators of soil quality in improved (silvo) pastoral systems in the tropics";;"Benito, Marta; Chagüezá, Yamileth; Arango, Jacobo; Botero, César; Teutscherová, Nikola; Sotelo Cabrera, Mauricio Efren; Vazquez, Eduardo; Pulleman, Mirjam; Gutierrez, Jhon Freddy";2017-01-01 00:00:00;;"https://www.altmetric.com/details/32590801"
865;1;1900-01-01 00:00:00;2199-12-31 23:59:59;865;"Soil macrofauna as indicators of soil quality in improved (silvo) pastoral systems in the tropics";;"Benito, Marta; Chagüezá, Yamileth; Arango, Jacobo; Botero, César; Teutscherová, Nikola; Sotelo Cabrera, Mauricio Efren; Vazquez, Eduardo; Pulleman, Mirjam; Gutierrez, Jhon Freddy";2017-01-01 00:00:00;;"https://www.altmetric.com/details/32590792"
866;1;1900-01-01 00:00:00;2199-12-31 23:59:59;866;"Soil macrofauna abundance under dominant tree species increases along a soil degradation gradient";"Soil Biology & Biochemistry";"Kamau S., Barrios, E., Karanja, N.K., Ayuke, F.O., Lehmann, J.";2017-09-01 00:00:00;"10.1016/j.soilbio.2017.04.016";"https://www.altmetric.com/details/39871201"
867;1;1900-01-01 00:00:00;2199-12-31 23:59:59;867;"Smallholder farmers’ perceptions and strategies for adaptation to climate change in Brong Ahafo and Upper West Regions of Ghana";;"Etwire, Prince Maxwell; Bamire, Simeon Adebayo; Akinola, Adebayo A.; Abdoulaye, Tahirou";2017-06-27 00:00:00;;"https://www.altmetric.com/details/21453201"
868;1;1900-01-01 00:00:00;2199-12-31 23:59:59;868;"Six steps: Reaching out to experts and stakeholders for RTB priorities.";;"CGIAR Research Program on Roots, Tubers and Bananas";2017-04-01 00:00:00;;"https://www.altmetric.com/details/31175695"
869;1;1900-01-01 00:00:00;2199-12-31 23:59:59;869;"Site-specific plans for the More Milk in Tanzania project, Tanga region";;"Mihayo, E.; Githinji, J.; Mkwama, N.; Mushi, A.; Twine, Edgar; Nandonde, S.";2017-05-01 00:00:00;;"https://www.altmetric.com/details/31175652"
870;1;1900-01-01 00:00:00;2199-12-31 23:59:59;870;"Site-specific plans for the More Milk in Tanzania project, Morogoro region";;"Mihayo, E.; Githinji, J.; Mkwama, N.; Mushi, A.; Twine, Edgar; Nandonde, S.";2017-05-30 00:00:00;;"https://www.altmetric.com/details/31175653"
871;1;1900-01-01 00:00:00;2199-12-31 23:59:59;871;"Seasonal differences in soil respiration and methane uptake in rubber plantation and rainforest";"Agriculture, Ecosystems & Environment";"Lang R., Blagodatsky, S., Xu, J., Cadisch, G.";2017-03-01 00:00:00;"10.1016/j.agee.2017.02.032";"https://www.altmetric.com/details/39871585"
872;1;1900-01-01 00:00:00;2199-12-31 23:59:59;872;"Scaling-up interventions to improve infant and young child feeding in India: What will it take?";"Maternal & Child Nutrition";"Menon, Purnima; Avula, Rasmi; Kadiyala, Suneetha; Oddo, Vanessa M.";2017-10-15 00:00:00;"10.1111/mcn.12414";"https://www.altmetric.com/details/32154345"
873;1;1900-01-01 00:00:00;2199-12-31 23:59:59;873;"Scaling up resilient agricultural practices, technologies and services in the vulnerable areas of India";;"Pant, Anjali; Sahin, Shehnab; Khatri-Chhetri, Arun; Pande, Kunal";2017-10-09 00:00:00;;"https://www.altmetric.com/details/27425486"
874;1;1900-01-01 00:00:00;2199-12-31 23:59:59;874;"Scaling Up Agricultural Innovation for Inclusive Livelihood and Productivity Outcomes in Sub-Saharan Africa: The Case of Nigeria";"African Development Review";"Oluseyi, Olagunju Kehinde; Kabir, Salman K.; Phillips, Francis; Ogunniyi, Adebayo; Adeyemi, Ogundipe";2017-06-28 00:00:00;"10.1111/1467-8268.12267";"https://www.altmetric.com/details/32154327"
875;1;1900-01-01 00:00:00;2199-12-31 23:59:59;875;"Scaling up agricultural adaptation through insurance: Bringing together insurance, big data and agricultural innovation";;"Hansen, James W; Hellin, Jon; Rose, Alison; Braun, Melody";2017-05-14 00:00:00;;"https://www.altmetric.com/details/43156428"
876;1;1900-01-01 00:00:00;2199-12-31 23:59:59;876;"RTB Revised Proposal September 2011";;"CGIAR Research Program on Roots, Tubers and Bananas";2017-06-01 00:00:00;;"https://www.altmetric.com/details/31175678"
877;1;1900-01-01 00:00:00;2199-12-31 23:59:59;877;"RTB Revised Proposal April 2011";;"CGIAR Research Program on Roots, Tubers and Bananas";2017-06-01 00:00:00;;"https://www.altmetric.com/details/31175677"
878;1;1900-01-01 00:00:00;2199-12-31 23:59:59;878;"RTB Rationale, Strategy and Impact.";;"CGIAR Research Program on Roots, Tubers and Bananas";2017-03-01 00:00:00;;"https://www.altmetric.com/details/31175730"
879;1;1900-01-01 00:00:00;2199-12-31 23:59:59;879;"RTB Publications and Acknowledgements Guidelines 2017";;"CGIAR Research Program on Roots, Tubers and Bananas";2017-06-01 00:00:00;;"https://www.altmetric.com/details/31175674"
880;1;1900-01-01 00:00:00;2199-12-31 23:59:59;880;"RTB Proposal 2017-2022, Volume III.";;"CGIAR Research Program on Roots, Tubers and Bananas";2017-04-01 00:00:00;;"https://www.altmetric.com/details/31175688"
881;1;1900-01-01 00:00:00;2199-12-31 23:59:59;881;"RTB Proposal 2017-2022, Volume II.";;"CGIAR Research Program on Roots, Tubers and Bananas";2017-06-01 00:00:00;;"https://www.altmetric.com/details/31175683"
882;1;1900-01-01 00:00:00;2199-12-31 23:59:59;882;"RTB Proposal 2017-2022, Volume I";;"CGIAR Research Program on Roots, Tubers and Bananas";2017-05-01 00:00:00;;"https://www.altmetric.com/details/31175684"
883;1;1900-01-01 00:00:00;2199-12-31 23:59:59;883;"RTB Pre-proposal-2017-2022.";;"CGIAR Research Program on Roots, Tubers and Bananas";2017-03-01 00:00:00;;"https://www.altmetric.com/details/31175738"
884;1;1900-01-01 00:00:00;2199-12-31 23:59:59;884;"RTB Performance Monitoring Report for 2013.";;"CGIAR Research Program on Roots, Tubers and Bananas";2017-01-01 00:00:00;;"https://www.altmetric.com/details/31175784"
885;1;1900-01-01 00:00:00;2199-12-31 23:59:59;885;"RTB Performance Monitoring Report for 2012.";;"CGIAR Research Program on Roots, Tubers and Bananas";2017-01-01 00:00:00;;"https://www.altmetric.com/details/31175787"
886;1;1900-01-01 00:00:00;2199-12-31 23:59:59;886;"RTB Performance Monitoring Report 2016.";;"CGIAR Research Program on Roots, Tubers and Bananas";2017-02-01 00:00:00;;"https://www.altmetric.com/details/31175764"
887;1;1900-01-01 00:00:00;2199-12-31 23:59:59;887;"RTB Performance Monitoring Report 2015.";;"CGIAR Research Program on Roots, Tubers and Bananas";2017-02-01 00:00:00;;"https://www.altmetric.com/details/31175775"
888;1;1900-01-01 00:00:00;2199-12-31 23:59:59;888;"RTB Performance Monitoring Report 2014.";;"CGIAR Research Program on Roots, Tubers and Bananas";2017-01-26 00:00:00;;"https://www.altmetric.com/details/31175780"
889;1;1900-01-01 00:00:00;2199-12-31 23:59:59;889;"RTB Mid-year Report 2012.";;"CGIAR Research Program on Roots, Tubers and Bananas";2017-02-01 00:00:00;;"https://www.altmetric.com/details/31175779"
890;1;1900-01-01 00:00:00;2199-12-31 23:59:59;890;"RTB Humidtropics planning workshop report (Amsterdam, the Netherlands, 4-6 Nov 2013).";;"CGIAR Research Program on Roots, Tubers and Bananas";2017-01-01 00:00:00;;"https://www.altmetric.com/details/31175865"
891;1;1900-01-01 00:00:00;2199-12-31 23:59:59;891;"RTB Gender Strategy.";;"CGIAR Research Program on Roots, Tubers and Bananas";2017-03-01 00:00:00;;"https://www.altmetric.com/details/31175707"
892;1;1900-01-01 00:00:00;2199-12-31 23:59:59;892;"RTB Extension Request 2015-2016.";;"CGIAR Research Program on Roots, Tubers and Bananas";2017-05-01 00:00:00;;"https://www.altmetric.com/details/31175686"
893;1;1900-01-01 00:00:00;2199-12-31 23:59:59;893;"RTB Branding Guidelines 2017";;"CGIAR Research Program on Roots, Tubers and Bananas";2017-06-03 00:00:00;;"https://www.altmetric.com/details/31175672"
894;1;1900-01-01 00:00:00;2199-12-31 23:59:59;894;"RTB Branding and Publications Guidelines 2014";;"CGIAR Research Program on Roots, Tubers and Bananas";2017-03-01 00:00:00;;"https://www.altmetric.com/details/31175739"
895;1;1900-01-01 00:00:00;2199-12-31 23:59:59;895;"RTB Annual Review and Planning Meeting Report 2017.";;"CGIAR Research Program on Roots, Tubers and Bananas";2017-02-01 00:00:00;;"https://www.altmetric.com/details/31175768"
896;1;1900-01-01 00:00:00;2199-12-31 23:59:59;896;"RTB Annual Review and Planning Meeting 2014.";;"CGIAR Research Program on Roots, Tubers and Bananas";2017-02-01 00:00:00;;"https://www.altmetric.com/details/31175778"
897;1;1900-01-01 00:00:00;2199-12-31 23:59:59;897;"RTB Annual Plan of Work and Budget (POWB) in 2013.";;"CGIAR Research Program on Roots, Tubers and Bananas";2017-03-01 00:00:00;;"https://www.altmetric.com/details/31175706"
898;1;1900-01-01 00:00:00;2199-12-31 23:59:59;898;"Roots, Tubers and Bananas Research.";;"CGIAR Research Program on Roots, Tubers and Bananas";2017-02-01 00:00:00;;"https://www.altmetric.com/details/31175758"
899;1;1900-01-01 00:00:00;2199-12-31 23:59:59;899;"Roles of social learning for the adoption of climate-smart agriculture innovations: Case study from My Loi Climate-Smart Village, Vietnam";;"Tran, Helene; Simelton, Elisabeth; Quinn, Claire";2017-03-27 00:00:00;;"https://www.altmetric.com/details/21852618"
900;1;1900-01-01 00:00:00;2199-12-31 23:59:59;900;"Review of the diversity of palm oil production systems in Indonesia: Case study of two provinces: Riau and Jambi";;"Levang, Patrice";2017-01-01 00:00:00;"10.17528/cifor/006462";"https://www.altmetric.com/details/20952427"
901;1;1900-01-01 00:00:00;2199-12-31 23:59:59;901;"Review of Roots, Tubers and Bananas CRP Proposal.";;"CGIAR Research Program on Roots, Tubers and Bananas";2017-03-01 00:00:00;;"https://www.altmetric.com/details/31175716"
902;1;1900-01-01 00:00:00;2199-12-31 23:59:59;902;"Review of Consortium Research Program: Root, tubers, and bananas for food security and income.";;"CGIAR Research Program on Roots, Tubers and Bananas";2017-03-01 00:00:00;;"https://www.altmetric.com/details/31175720"
903;1;1900-01-01 00:00:00;2199-12-31 23:59:59;903;"Results of a global online expert survey: Major constraints, opportunities and trends for banana production and marketing and priorities for future RTB banana research.";;"CGIAR Research Program on Roots, Tubers and Bananas";2017-01-01 00:00:00;;"https://www.altmetric.com/details/31175802"
904;1;1900-01-01 00:00:00;2199-12-31 23:59:59;904;"Results baseline survey at municipal level in Santander, Colombia";;"CGIAR Research Program on Climate Change, Agriculture and Food Security";2017-06-05 00:00:00;;"https://www.altmetric.com/details/20939740"
905;1;1900-01-01 00:00:00;2199-12-31 23:59:59;905;"Reproductive options for a more efficient system delivery of improved genetics from the communities to the communities";;"Rischkowsky, B.; Haile, Aynalem; Rekik, M.";2017-06-30 00:00:00;;"https://www.altmetric.com/details/31176118"
906;1;1900-01-01 00:00:00;2199-12-31 23:59:59;906;"Reproductive interventions for more efficient sheep and goats breeding programs";;"Rekik, M.";2017-09-05 00:00:00;;"https://www.altmetric.com/details/31176115"
907;1;1900-01-01 00:00:00;2199-12-31 23:59:59;907;"Report on Training of Trainers (TOT) in Tigray Region on Africa RISING Project Validated Technologies/Innovations in the Ethiopian Highland";;"Ayenew, Y.; Adie, Aberra; Asfaw, A.; Hailemariam, G.; Kinfu, S.; Hagoss, T.; Ebrahim, M.";2017-04-30 00:00:00;;"https://www.altmetric.com/details/28756391"
908;1;1900-01-01 00:00:00;2199-12-31 23:59:59;908;"Report of the end of project workshop";;"Kisauzi, D; Naziri, D.; Kisauzi, T.; Mayanja, Sarah";2017-09-01 00:00:00;;"https://www.altmetric.com/details/31175591"
909;1;1900-01-01 00:00:00;2199-12-31 23:59:59;909;"Relationships between climate at origin and seedling traits in eight Panafrican provenances of Vitellaria paradoxa C.F. Gaertn. under imposed drought stress";"Agroforestry Systems";"Bayala J., Sanon, Z., Bazié, P., Sanou, J., Roupsard, O., Jourdan, C., Ræbild, A., Kelly, B., Okullo, J.B.L., Thiam, M., Yidana, J.";2017-04-05 00:00:00;"10.1007/s10457-017-0091-8";"https://www.altmetric.com/details/39871185"
910;1;1900-01-01 00:00:00;2199-12-31 23:59:59;910;"Reflections on the Stories of Change study in Odisha";"Global Food Security";"Adhikari, Ramesh K.; Ka, Abdoulaye; Hailu, Tesfaye; Devkota, Madhu Dixit; Pelletier, David; Ahuja, Arti; Flowers, Cara; Verburg, Gerda; Fekete, Georgina; Hughes, Rob; El Arifeen, Shams";2017-06-01 00:00:00;"10.1016/j.gfs.2017.02.002";"https://www.altmetric.com/details/27964474"
911;1;1900-01-01 00:00:00;2199-12-31 23:59:59;911;"Reducing Global Warming Potential through Sustainable Intensification of Basmati Rice-Wheat Systems in India";"Sustainability (2071-1050)";"Sapkota, Tek; Stirling, Clare M.; Shankar, Vivek; Jat, Mangi L.; Jat, Hanuman S.; Grewal, Mohinder S; Singh, Love K; Rai, Munmun";2017-05-13 00:00:00;"10.3390/su9061044";"https://www.altmetric.com/details/24652252"
912;1;1900-01-01 00:00:00;2199-12-31 23:59:59;912;"Reducing food loss in agricultural development projects through value chain efficiency";;"White, Julianna; Pirolli, Gillian; Pen?a, Olivia; Nash, Julie; Gurwick, Noel; Wollenberg, Eva; Galford, Gillian";2017-10-26 00:00:00;;"https://www.altmetric.com/details/28038448"
913;1;1900-01-01 00:00:00;2199-12-31 23:59:59;913;"Recovering banana production in BBTD affected areas: Community & farm household approaches (Bujumbura, Burundi, 20-25 Jan 2014).";;"CGIAR Research Program on Roots, Tubers and Bananas";2017-01-01 00:00:00;;"https://www.altmetric.com/details/31175845"
914;1;1900-01-01 00:00:00;2199-12-31 23:59:59;914;"Re-wetting peatlands";;"Sasmito, Sigit; Murdiyarso, Daniel; Hergoualc'h, Kristell";2017-01-01 00:00:00;"10.17528/cifor/006441";"https://www.altmetric.com/details/19737189"
915;1;1900-01-01 00:00:00;2199-12-31 23:59:59;915;"Rapport du Troisième Atelier de la plateforme multi-acteurs de Tenkodogo du projet: Innovations Agricoles ciblées et gestion des services écosystémiques dans le Nord du Bassin de la Volta (TAI/WLE)";;"Boundaogo, M.; Jones, A.M.S.";2017-01-01 00:00:00;;"https://www.altmetric.com/details/23654907"
916;1;1900-01-01 00:00:00;2199-12-31 23:59:59;916;"Rapport de l’Atelier de la plateforme multi-acteurs WP4 Tenkodogo du projet: Targeting Agricultural innovation and Ecosystem Services Management in the Northern Volta Basin";;"Olivier, H.A.B.; Boundaogo, M.";2017-01-01 00:00:00;;"https://www.altmetric.com/details/23654891"
917;1;1900-01-01 00:00:00;2199-12-31 23:59:59;917;"Pulling the chain";;"CGIAR Research Program on Water, Land and Ecosystems (WLE)";2017-01-01 00:00:00;;"https://www.altmetric.com/details/20787830"
918;1;1900-01-01 00:00:00;2199-12-31 23:59:59;918;"Propuesta metodológica para grupos focales de género: Empoderamiento y equidad en la toma de decisiones de familias de línea base de ECA MAP Noruega";;"Ramirez, Felicia; Twyman, Jennifer; Arguedas, Maureen; Mercado, Leida; Sellare, Jorge";2017-02-15 00:00:00;;"https://www.altmetric.com/details/22002657"
919;1;1900-01-01 00:00:00;2199-12-31 23:59:59;919;"Promoting gender inclusiveness and empowerment in hydropower development";;"Buechler, Stephanie J.";2017-01-01 00:00:00;;"https://www.altmetric.com/details/32275668"
920;1;1900-01-01 00:00:00;2199-12-31 23:59:59;920;"Projet Interface forêt-ferme en Afrique de l'Ouest (WAFFI): Renforcement de la sécurité alimentaire, des revenus et de l'équité des genres au sein de l'interface forêt-ferme en Afrique de l'Ouest";;"CIFOR";2017-01-01 00:00:00;"10.17528/cifor/006421";"https://www.altmetric.com/details/20363547"
921;1;1900-01-01 00:00:00;2199-12-31 23:59:59;921;"Progressing towards climate resilient agriculture; top ten success stories from CCAFS in South Asia";;"CGIAR Research Program on Climate Change, Agriculture and Food Security";2017-09-11 00:00:00;;"https://www.altmetric.com/details/25333718"
922;1;1900-01-01 00:00:00;2199-12-31 23:59:59;922;"Program and book of abstracts of the First Global Conference on Yam";;"International Institute of Tropical Agriculture";2017-09-01 00:00:00;;"https://www.altmetric.com/details/31175452"
923;1;1900-01-01 00:00:00;2199-12-31 23:59:59;923;"Profiles of milk-producer groups in the More Milk in Tanzania project, Tanga";;"Nkya, E.; Osarya, J.; Lucas, M.; Githinji, J.";2017-05-30 00:00:00;;"https://www.altmetric.com/details/31175656"
924;1;1900-01-01 00:00:00;2199-12-31 23:59:59;924;"Profiles of milk-producer groups in the More Milk in Tanzania project, Morogoro";;"Nkya, E.; Osarya, J.; Lucas, M.; Githinji, J.";2017-05-01 00:00:00;;"https://www.altmetric.com/details/31175660"
925;1;1900-01-01 00:00:00;2199-12-31 23:59:59;925;"Process coordinators workshop: Results-based management (RBM) (Nairobi, Kenya, 9-11 June 2014).";;"CGIAR Research Program on Roots, Tubers and Bananas";2017-01-01 00:00:00;;"https://www.altmetric.com/details/31175850"
926;1;1900-01-01 00:00:00;2199-12-31 23:59:59;926;"Prioritizing fodder species based on traditional knowledge: a case study of mithun (Bos frontalis) in Dulongjiang area, Yunnan Province, Southwest China";"Journal of Ethnobiology and Ethnomedicine";"Geng Y., Hu, G., Ranjitkar, S., Wang, Y., Bu, D., Pei, S., Ou, X., Lu, Y., Ma, X., Xu, J.";2017-05-04 00:00:00;"10.1186/s13002-017-0153-z";"https://www.altmetric.com/details/39872108"
927;1;1900-01-01 00:00:00;2199-12-31 23:59:59;927;"Prioritization of options for sweetpotato research for development – Results from a global expert survey.";;"CGIAR Research Program on Roots, Tubers and Bananas";2017-01-01 00:00:00;;"https://www.altmetric.com/details/31175801"
928;1;1900-01-01 00:00:00;2199-12-31 23:59:59;928;"Prioritization of options for cassava research for development – Results from a global expert survey.";;"CGIAR Research Program on Roots, Tubers and Bananas";2017-01-01 00:00:00;;"https://www.altmetric.com/details/31175803"
