pk_id_altmetrics_info;version;date_from;date_to;id;"title";"journal_title";"author";publication_date;"doi";"detail_url"
285;1;1900-01-01 00:00:00;2199-12-31 23:59:59;285;"Making Sense of Sustainability: A Practice Theories Approach to Buying Food";"Sustainability";"Brons, Anke ; Oosterveer, P.J.M.";2017-03-21 00:00:00;"10.3390/su9030467";"https://www.altmetric.com/details/17852389"
286;1;1900-01-01 00:00:00;2199-12-31 23:59:59;286;"Learning from REDD+: a response to Fletcher et al.";"Conservation Biology";"Sunderlin, William; Wunder, Sven; Martius, Georg; Larson, Anne; Duchelle, Amy; Wong, Grace";2017-04-29 00:00:00;"10.1111/cobi.12933";"https://www.altmetric.com/details/20317944"
287;1;1900-01-01 00:00:00;2199-12-31 23:59:59;287;"Improving child nutrition and development through community-based childcare centres in Malawi – The NEEP-IE study: study protocol for a randomised controlled trial";"Trials";"Chidalengwa, George; Margolies, Amy; Twalibu, Aisha; Roschnik, Natalie; Sproule, Kathryn; Gelli, Aulo; Gladstone, Melissa; Kariger, Patricia; Santacroce, Marco; Kutundu, Mangani; Theis, Sophie; Cooper, Amrik; Moorhead, Tyler";2017-06-19 00:00:00;"10.1186/s13063-017-2003-7";"https://www.altmetric.com/details/21451584"
288;1;1900-01-01 00:00:00;2199-12-31 23:59:59;288;"Guinea pig or pioneer: Translating global environmental objectives through to local actions in Central Kalimantan, Indonesia’s REDD+ pilot province";"Global Environmental Change Part A: Human & Policy Dimensions";"Sanders, A.J.P., da Silva Hyldmo, H., Prasti H., R.D., Ford, R.M., Larson, A.M., Keenan, R.J.";2017-01-06 00:00:00;"10.1016/j.gloenvcha.2016.12.003";"https://www.altmetric.com/details/15258299"
289;1;1900-01-01 00:00:00;2199-12-31 23:59:59;289;"Guide to chicken health and management in Ethiopia: For farmers and development agents";;"Christley, Robert; Wigley, Paul; Collins, M.; Bettridge, Judy; Amare, A.; Habte, T.";2017-07-30 00:00:00;;"https://www.altmetric.com/details/28404816"
290;1;1900-01-01 00:00:00;2199-12-31 23:59:59;290;"Farm-scale greenhouse gas balances, hotspots and uncertainties in smallholder crop-livestock systems in Central Kenya";"Agriculture, Ecosystems & Environment";"Vaast, Philippe; Oelofse, Myles; Neergaard, Andreas de; Ortiz Gonzalo, Daniel; Rosenstock, Todd S.; Albrecht, Alain";2017-10-01 00:00:00;"10.1016/j.agee.2017.06.002";"https://www.altmetric.com/details/23455903"
291;1;1900-01-01 00:00:00;2199-12-31 23:59:59;291;"Environmental predictors of bovine Eimeria infection in western Kenya";"Tropical Animal Health & Production";"Gitau, G.K.; Wardrop, N.A.; Fèvre, Eric Maurice; Thomas, Lian Francesca.; Makau, D.N.; Cook, Elizabeth Anne Jessie; Muchemi, G.K.; de Glanville, William Anson";2017-01-04 00:00:00;"10.1007/s11250-016-1209-0";"https://www.altmetric.com/details/15632974"
292;1;1900-01-01 00:00:00;2199-12-31 23:59:59;292;"Diet transformation in Africa: the case of Ethiopia";"Agricultural Economics";"Dereje, Mekdim; Minten, Bart; Worku, Ibrahim Hassen; Hirvonen, Kalle";2017-11-01 00:00:00;"10.1111/agec.12387";"https://www.altmetric.com/details/31598836"
293;1;1900-01-01 00:00:00;2199-12-31 23:59:59;293;"Determinants of vaccination coverage and consequences for rabies control in Bali, Indonesia";"Frontiers in Veterinary Science";"Arief, R.A., Hampson, K., Jatikusumah, A., Widyastuti, M.D.W., Sunandar, Basri, C., Putra, A.A.G., Willyanto, I., Estoepangestie, A.T.S., Mardiana, I.W., Kesuma, I.K.G.N., Sumantra, I.P., Doherty, P.F. Jr., Salman, M.D., Gilbert, J. and Unger, F.";2017-01-09 00:00:00;"10.3389/fvets.2016.00123";"https://www.altmetric.com/details/17282254"
294;1;1900-01-01 00:00:00;2199-12-31 23:59:59;294;"Could REDD+ mechanisms induce logging companies to reduce forest degradation in Central Africa?";"Journal of Forest Economics";"Sonwa, Denis; Guizol, Philippe; Atyi, Richard; Lescuyer, Guillaume";2017-01-01 00:00:00;"10.1016/j.jfe.2017.10.001";"https://www.altmetric.com/details/29165454"
295;1;1900-01-01 00:00:00;2199-12-31 23:59:59;295;"Consideraciones para la producción artesanal de semilla de fríjol. Cartilla 3";;"CCAFS; CIAT";2017-02-07 00:00:00;;"https://www.altmetric.com/details/16960411"
296;1;1900-01-01 00:00:00;2199-12-31 23:59:59;296;"Bushmeat and human health: Assessing the Evidence in tropical and sub-tropical forests";"Ethnobiology and Conservation";"Van Vliet, N., Moreno, J., Gomez, J., Zhou, W., Fa, J.E., Golden, C., Nobrega Alves, R.R., Nasi, R.";2017-01-01 00:00:00;"10.15451/ec2017-04-6.3-1-45";"https://www.altmetric.com/details/19801369"
297;1;1900-01-01 00:00:00;2199-12-31 23:59:59;297;"Be patient when measuring hyperbolic discounting: Stationarity, time consistency and time invariance in a field experiment";"Journal of Development Economics";"Kramer, Berber N.; Janssens, Wendy; Swart, Lisette";2017-05-01 00:00:00;"10.1016/j.jdeveco.2016.12.011";"https://www.altmetric.com/details/15710104"
298;1;1900-01-01 00:00:00;2199-12-31 23:59:59;298;"Association between agronomic traits and aflatoxin accumulation in diverse maize lines grown under two soil nitrogen levels in Eastern Kenya";"Field Crops Research";"Mutiga, S.K., Morales, L., Angwenyi, S., Wainaina, J., Harvey, J., Das, B. and Nelson, R.J.";2017-04-01 00:00:00;"10.1016/j.fcr.2017.02.007";"https://www.altmetric.com/details/17142871"
299;1;1900-01-01 00:00:00;2199-12-31 23:59:59;299;"Assessing impacts on ecosystem services under various plausible oil palm expansion scenarios in Central Kalimantan, Indonesia";;"Baral, Himlal; Pacheco, Pablo; Laumonier, Yves";2017-01-01 00:00:00;"10.17528/cifor/006479";"https://www.altmetric.com/details/20772335"
300;1;1900-01-01 00:00:00;2199-12-31 23:59:59;300;"An investigation into aflatoxin M 1 in slaughtered fattening pigs and awareness of aflatoxins in Vietnam";"BMC Veterinary Research";"Hu Suk Lee, Lindahl, J., Hung Nguyen-Viet, Nguyen Viet Khong, Vuong Bui Nghia, Huyen Nguyen Xuan and Grace, D.";2017-11-28 00:00:00;"10.1186/s12917-017-1297-8";"https://www.altmetric.com/details/29872176"
301;1;1900-01-01 00:00:00;2199-12-31 23:59:59;301;"Adopting improved forage grasses and legumes for semi-arid zones in Tanzania";;"Mathias, J.; Mwilawa, A.; Mwendia, Solomon; Notenbaert, An Maria Omer";2017-04-01 00:00:00;;"https://www.altmetric.com/details/20787846"
302;1;1900-01-01 00:00:00;2199-12-31 23:59:59;302;"Understand, prevent and control Anthrax";;"Wieland, Barbara; Desta, Hiwot";2017-05-01 00:00:00;;"https://www.altmetric.com/details/20041134"
303;1;1900-01-01 00:00:00;2199-12-31 23:59:59;303;"Training women in small ruminant husbandry and health";;"Wieland, Barbara; Desta, Hiwot; Mulema, Annet A.; Alemu, Biruk; Kinati, Wole";2017-05-01 00:00:00;;"https://www.altmetric.com/details/20165367"
304;1;1900-01-01 00:00:00;2199-12-31 23:59:59;304;"Ties that bind: Local networks, communities and adaptive capacity in rural Ghana";"Journal of Rural Studies";"Thornton, Thomas F.; Ventresca, Marc J.; Helfgott, Ariella E.S.; Sova, Chase; Chaudhury, Abrar S.";2017-07-01 00:00:00;"10.1016/j.jrurstud.2017.05.010";"https://www.altmetric.com/details/21123564"
305;1;1900-01-01 00:00:00;2199-12-31 23:59:59;305;"Thermometers to improve traditional dairy products";;"Wieland, Barbara; Hilali, M. El-Dine; Rischkowsky, Barbara A.";2017-05-01 00:00:00;;"https://www.altmetric.com/details/20041133"
306;1;1900-01-01 00:00:00;2199-12-31 23:59:59;306;"The Impacts of Climate Change on Food Security and Livelihoods in Karamoja";;"Chaplin, Daniel; Wabyona, Edgar; Semambo, Medi; Mujuni, Godfrey; Byekwaso, Flavia; Krishnaswamy, Siddharth; Bantaze, James; Nyasimi, Mary";2017-03-17 00:00:00;;"https://www.altmetric.com/details/19776914"
307;1;1900-01-01 00:00:00;2199-12-31 23:59:59;307;"The CSA Papers: Critical investigations to support climate-smart agriculture development. An effort to analyze, publish, and present previously unreleased data on CSA";;"Girvetz, Evan H.; Nowak, Andreea; Rosenstock, Todd S.";2017-06-29 00:00:00;;"https://www.altmetric.com/details/21453211"
308;1;1900-01-01 00:00:00;2199-12-31 23:59:59;308;"Stories of Change in nutrition: An overview";"Global Food Security";"van den Bold, Mara; Gillespie, Stuart";2017-04-01 00:00:00;"10.1016/j.gfs.2017.02.004";"https://www.altmetric.com/details/19610865"
309;1;1900-01-01 00:00:00;2199-12-31 23:59:59;309;"Smallholder farmers in eastern Africa and climate change: a review of risks and adaptation options with implications for future adaptation programmes";"Climate and Development";"Radeny, Maren A.O.; Misiko, Michael; Gakii, Mercy; Stirling, Clare M.; Sonder, Kai; Kyazze, Florence B.; Serem, Jared; Gbegbelegbe, Sika; Nafula, Lydia; Tongruksawattana, Songporne";2017-09-17 00:00:00;"10.1080/17565529.2017.1374236";"https://www.altmetric.com/details/26463675"
310;1;1900-01-01 00:00:00;2199-12-31 23:59:59;310;"Small ruminant value chain development in Yabello, Ethiopia";;"International Livestock Research Institute; International Center for Agricultural Research in the Dry Areas";2017-04-15 00:00:00;;"https://www.altmetric.com/details/5922176"
311;1;1900-01-01 00:00:00;2199-12-31 23:59:59;311;"Small ruminant value chain development in Waq Abergelle, Ethiopia";;"International Livestock Research Institute; International Center for Agricultural Research in the Dry Areas";2017-04-15 00:00:00;;"https://www.altmetric.com/details/5922173"
312;1;1900-01-01 00:00:00;2199-12-31 23:59:59;312;"Small ruminant value chain development in Tanqua Abergelle, Ethiopia";;"International Livestock Research Institute; International Center for Agricultural Research in the Dry Areas";2017-04-15 00:00:00;;"https://www.altmetric.com/details/5922170"
313;1;1900-01-01 00:00:00;2199-12-31 23:59:59;313;"Small ruminant value chain development in Shinille, Ethiopia";;"International Livestock Research Institute; International Center for Agricultural Research in the Dry Areas";2017-04-15 00:00:00;;"https://www.altmetric.com/details/5922177"
314;1;1900-01-01 00:00:00;2199-12-31 23:59:59;314;"Small ruminant value chain development in Menz (Gera and Mama), Ethiopia";;"International Livestock Research Institute; International Center for Agricultural Research in the Dry Areas";2017-04-15 00:00:00;;"https://www.altmetric.com/details/5922171"
315;1;1900-01-01 00:00:00;2199-12-31 23:59:59;315;"Small ruminant value chain development in Doyogena, Ethiopia";;"International Livestock Research Institute; International Center for Agricultural Research in the Dry Areas";2017-04-15 00:00:00;;"https://www.altmetric.com/details/5922175"
316;1;1900-01-01 00:00:00;2199-12-31 23:59:59;316;"Small ruminant value chain development in Bonga, Ethiopia";;"International Livestock Research Institute; International Center for Agricultural Research in the Dry Areas";2017-04-15 00:00:00;;"https://www.altmetric.com/details/19582991"
317;1;1900-01-01 00:00:00;2199-12-31 23:59:59;317;"Small ruminant value chain development in Atsbi, Ethiopia";;"International Livestock Research Institute; International Center for Agricultural Research in the Dry Areas";2017-04-15 00:00:00;;"https://www.altmetric.com/details/5922172"
318;1;1900-01-01 00:00:00;2199-12-31 23:59:59;318;"Simple smokers to improve traditional dairy products";;"Wieland, Barbara; Hilali, M. El-Dine; Rischkowsky, Barbara A.";2017-05-01 00:00:00;;"https://www.altmetric.com/details/20308134"
319;1;1900-01-01 00:00:00;2199-12-31 23:59:59;319;"Select effective fasciolicides to control sheep liver fluke";;"Abebe, A.";2017-05-01 00:00:00;;"https://www.altmetric.com/details/20165370"
320;1;1900-01-01 00:00:00;2199-12-31 23:59:59;320;"Seasonal patterns of dengue fever and associated climate factors in 4 provinces in Vietnam from 1994 to 2013";"BMC Infectious Diseases";"Hu Suk Lee, Hung Nguyen-Viet, Vu Sinh Nam, Lee, M., Won, S., Phuc Pham Duc and Grace, D.";2017-03-20 00:00:00;"10.1186/s12879-017-2326-8";"https://www.altmetric.com/details/18358450"
321;1;1900-01-01 00:00:00;2199-12-31 23:59:59;321;"Responsible use of antimicrobials in small ruminants";;"Wieland, Barbara; Desta, Hiwot; Alemayehu, Gezahegn; Alemu, Biruk";2017-05-01 00:00:00;;"https://www.altmetric.com/details/20103131"
322;1;1900-01-01 00:00:00;2199-12-31 23:59:59;322;"Report of the Maziwa Zaidi Policy Forum on inclusive investment opportunities in Tanzania’s dairy value chains: Exploiting the evidence, Dar es Salaam, 23-24 May 2017";;"Ballantyne, Peter; Omore, Amos; Twine, Edgar; Kawuma, B.; Becon, M.";2017-06-30 00:00:00;;"https://www.altmetric.com/details/21842533"
323;1;1900-01-01 00:00:00;2199-12-31 23:59:59;323;"Reducing lamb and kid mortality";;"Wieland, Barbara; Desta, Hiwot; Alemayehu, Gezahegn; Alemu, Biruk";2017-05-01 00:00:00;;"https://www.altmetric.com/details/20103127"
324;1;1900-01-01 00:00:00;2199-12-31 23:59:59;324;"Public and private sustainability standards in the oil palm sector: Compliance barriers facing Indonesia's independent oil palm smallholders";;"Komarudin, Heru; Andrianto, Agus; Schoneveld, George; Okarda, Beni";2017-01-01 00:00:00;"10.17528/cifor/006556";"https://www.altmetric.com/details/23403740"
325;1;1900-01-01 00:00:00;2199-12-31 23:59:59;325;"Perception of climate change and adaptation strategies in Vietnam";"International Journal of Climate Change Strategies and Management";"Pede, Valerian Olivier; Mishra, Ashok K.";2017-08-21 00:00:00;"10.1108/ijccsm-01-2017-0014";"https://www.altmetric.com/details/28756394"
326;1;1900-01-01 00:00:00;2199-12-31 23:59:59;326;"Pasteurization to improve traditional dairy products";;"Wieland, Barbara; Hilali, M. El-Dine; Rischkowsky, Barbara A.";2017-05-01 00:00:00;;"https://www.altmetric.com/details/20308133"
327;1;1900-01-01 00:00:00;2199-12-31 23:59:59;327;"Off-grid solar milk cooling systems offer technical and market opportunities for remote dairy producers";;"Omore, Amos; Lukuyu, J.; Blanchard, R.";2017-05-23 00:00:00;;"https://www.altmetric.com/details/20854707"
328;1;1900-01-01 00:00:00;2199-12-31 23:59:59;328;"Monitoring population diet quality and nutrition status with household consumption and expenditure surveys: suggestions for a Bangladesh baseline";"Food Security";"Fiedler, John L.; Lividini, Keith";2017-01-14 00:00:00;"10.1007/s12571-016-0631-5";"https://www.altmetric.com/details/15951730"
329;1;1900-01-01 00:00:00;2199-12-31 23:59:59;329;"Monitoring and evaluation of climate resilience for agricultural development – A review of currently available tools";"World Development Perspectives";"Barron, J.; Debevec, Liza; Barron, Jennie; Douxchamps, Sabine; Douxchamps, S.; Debevec, L.; Giordano, Meredith; Jennie, Barron; Giordano, M.";2017-03-01 00:00:00;"10.1016/j.wdp.2017.02.001";"https://www.altmetric.com/details/20165502"
330;1;1900-01-01 00:00:00;2199-12-31 23:59:59;330;"Milk fat separation to accelerate butter production and reduce labour";;"Wieland, Barbara; Hilali, M. El-Dine; Rischkowsky, Barbara A.";2017-05-01 00:00:00;;"https://www.altmetric.com/details/20308131"
331;1;1900-01-01 00:00:00;2199-12-31 23:59:59;331;"Mechanization outsourcing clusters and division of labor in Chinese agriculture";"China Economic Review (13506390)";"Yang, Jin; Zhang, Xiaobo; Thomas, Reardon";2017-02-01 00:00:00;"10.1016/j.chieco.2017.01.012";"https://www.altmetric.com/details/16653258"
332;1;1900-01-01 00:00:00;2199-12-31 23:59:59;332;"Maziwa Zaidi—Lessons for ASDP-2 Component 2";;"Omore, Amos; Kurwijila, Lusato; Twine, Edgar";2017-05-23 00:00:00;;"https://www.altmetric.com/details/20850194"
333;1;1900-01-01 00:00:00;2199-12-31 23:59:59;333;"Maziwa Zaidi (More Milk) in Tanzania: Improved forages in Lushoto have wide adoption potential";;"Ndah, Hycenth Tim; Paul, Birthe; Nkwain, Vandoline; Nzogela, Beatus; Schuler, Johannes";2017-01-01 00:00:00;;"https://www.altmetric.com/details/20787848"
334;1;1900-01-01 00:00:00;2199-12-31 23:59:59;334;"Maziwa Zaidi (More Milk) in Tanzania: Improved forages can boost milk production in Tanzania’s Highlands";;"Mwendia, Solomon; Paul, Birthe; Nzogela, Beatus; Lissu, Cyril; Sommer, Rolf";2017-04-01 00:00:00;;"https://www.altmetric.com/details/20787850"
335;1;1900-01-01 00:00:00;2199-12-31 23:59:59;335;"Maziwa Zaidi - Lessons for ASDP-2 Component 3";;"Omore, Amos; Kurwijila, Lusato; Twine, Edgar";2017-05-23 00:00:00;;"https://www.altmetric.com/details/20854709"
336;1;1900-01-01 00:00:00;2199-12-31 23:59:59;336;"Livestock health priorities in the Tanzania livestock master plan";;"Gebru, G.; Maziku, M.; Stapleton, J.";2017-10-15 00:00:00;;"https://www.altmetric.com/details/27607393"
337;1;1900-01-01 00:00:00;2199-12-31 23:59:59;337;"Irrigated Improved forages for smallholder dairy in Kilosa, Mvomero and Babati Districts, Tanzania";;"Ngunga, D.; Mwilawa, A.; Lukuyu, Ben";2017-05-23 00:00:00;;"https://www.altmetric.com/details/20854706"
338;1;1900-01-01 00:00:00;2199-12-31 23:59:59;338;"Integrated herd health approach to reduce impact of respiratory diseases";;"Wieland, Barbara; Desta, Hiwot; Alemayehu, Gezahegn; Alemu, Biruk";2017-05-01 00:00:00;;"https://www.altmetric.com/details/20165364"
339;1;1900-01-01 00:00:00;2199-12-31 23:59:59;339;"Innovation platforms for information sharing, market access and nurturing of smaller innovation platforms";;"Omore, Amos; Maina, M.; Cadilhon, Jo; Kago, K.M.";2017-05-23 00:00:00;;"https://www.altmetric.com/details/20850193"
340;1;1900-01-01 00:00:00;2199-12-31 23:59:59;340;"Improving the reproductive performance of small ruminants";;"Wieland, Barbara; Desta, Hiwot; Alemayehu, Gezahegn; Alemu, Biruk";2017-05-01 00:00:00;;"https://www.altmetric.com/details/20103130"
341;1;1900-01-01 00:00:00;2199-12-31 23:59:59;341;"How comparable are cross-country data on agricultural public expenditures?";"Global Food Security";"Anson, Richard; Mogues, Tewodaj";2017-09-01 00:00:00;"10.1016/j.gfs.2017.09.001";"https://www.altmetric.com/details/26474227"
342;1;1900-01-01 00:00:00;2199-12-31 23:59:59;342;"Household Exposure to Livestock and Health in the CHILILAB HDSS Cohort, Vietnam";"Asia-Pacific Journal of Public Health";"Sinh Dang-Xuan, MacDonald, L.E., Schurer, J.M., Hung Nguyen-Viet and Phuc Pham-Duc.";2017-07-18 00:00:00;"10.1177/1010539517712758";"https://www.altmetric.com/details/22269376"
343;1;1900-01-01 00:00:00;2199-12-31 23:59:59;343;"Harvesting more grain zinc of wheat for human health";"Scientific Reports";"Chen, XP; Zhang, YQ; Tong, YP; Xue, YF; Liu, DY; Zhang, W; Deng, Y; Meng, QF; Yue, SC; Yan, P; Cui, ZL; Shi, XJ; Guo, SW; Sun, YX; Ye, YL; Wang, ZH; Jia, LL; Ma, WQ; He, MR; Zhang, XY; Kou, CL; Li, YT; Tan, DS; Cakmak, I; Zhang, FS; Zou, CQ.";2017-08-01 00:00:00;"10.1038/s41598-017-07484-2";"https://www.altmetric.com/details/23388039"
344;1;1900-01-01 00:00:00;2199-12-31 23:59:59;344;"Getting by in the dry season—Ololilis in Tanzania";;"Lukuyu, Ben; Galie, Alessandra";2017-05-23 00:00:00;;"https://www.altmetric.com/details/20850192"
345;1;1900-01-01 00:00:00;2199-12-31 23:59:59;345;"Genetic impact of Rht dwarfing genes on grain micronutrients concentration in wheat";"Field Crops Research";"Guzmán, Carlos; Huerta, Julio; Velu, Govindan; Singh, Ravi P.";2017-12-01 00:00:00;"10.1016/j.fcr.2017.09.030";"https://www.altmetric.com/details/27212870"
346;1;1900-01-01 00:00:00;2199-12-31 23:59:59;346;"Gendered perspectives on smallholder cattle production and health management in three sites in Tanzania";;"Mattioli, R.C.; Wieland, Barbara; Distefano, F.; Kangogo, D.; Galiè, Alessandra; Baltenweck, Isabelle";2017-12-01 00:00:00;"10.19268/jgafs.232017.3";"https://www.altmetric.com/details/31637700"
347;1;1900-01-01 00:00:00;2199-12-31 23:59:59;347;"Gender-differences in Agro-Climate Information Services (Findings from ACIS baseline survey in Ha Tinh and Dien Bien provinces, Vietnam)";;"Smith, Abigail; Simelton, Elisabeth; Duong, Minh Tuan; Coulier, Miguel; Le, Tam Thi";2017-09-18 00:00:00;;"https://www.altmetric.com/details/26435512"
348;1;1900-01-01 00:00:00;2199-12-31 23:59:59;348;"Gender perceptions of livestock ownership and their implications for food security";;"Galie, Alessandra";2017-05-23 00:00:00;;"https://www.altmetric.com/details/20850195"
349;1;1900-01-01 00:00:00;2199-12-31 23:59:59;349;"Gender matters in small ruminant value chain transformation in Ethiopia";;"Mulema, Annet; Kinati, Wole";2017-05-01 00:00:00;;"https://www.altmetric.com/details/20165368"
350;1;1900-01-01 00:00:00;2199-12-31 23:59:59;350;"Formal versus informal: Efficiency, inclusiveness and financing of dairy value chains in Indian Punjab";"Journal of Rural Studies";"Khan, Md. Tajuddin; Birthal,  Pratap Singh; Chaudhary, Khyali R.; Chand, Ramesh; Joshi, Pramod Kumar; Saxena, Raka; Rajkhowa, Pallavi; Khan, Mohd. Arshad";2017-08-01 00:00:00;"10.1016/j.jrurstud.2017.06.009";"https://www.altmetric.com/details/21876183"
351;1;1900-01-01 00:00:00;2199-12-31 23:59:59;351;"Fodder market opportunities for smallholder dairying in Tanzania";;"Njehu, A.; Omore, Amos; Mwilawa, A.; Rao, E.J.O.; Lukuyu, M.; Lukuyu, Ben";2017-05-23 00:00:00;;"https://www.altmetric.com/details/20854711"
352;1;1900-01-01 00:00:00;2199-12-31 23:59:59;352;"Factors influencing maternal nutrition practices in a large scale maternal, newborn and child health program in Bangladesh";"PLoS ONE";"Menon, Purnima; Nguyen, Phuong Hong; Aktar, Bachera; Tran, Lan Mai; Afsana, Kaosar; Mahmud, Zeba; Sanghvi, Tina; Kim, Sunny S.";2017-07-10 00:00:00;"10.1371/journal.pone.0179873";"https://www.altmetric.com/details/21786739"
353;1;1900-01-01 00:00:00;2199-12-31 23:59:59;353;"Do low-income households in Tanzania derive income and nutrition benefits from dairy innovations?";;"Kidoido, Michael; Korir, L.";2017-05-23 00:00:00;;"https://www.altmetric.com/details/20850191"
354;1;1900-01-01 00:00:00;2199-12-31 23:59:59;354;"Desho grass to feed livestock in mid to high altitudes";;"Wamatu, J.; Asmare, B.; Rischkowsky, B.";2017-05-01 00:00:00;;"https://www.altmetric.com/details/20103129"
355;1;1900-01-01 00:00:00;2199-12-31 23:59:59;355;"Développement participatif d'un plan de gestion durable de la chasse villageoise: Guide pratique et exemples d'application en Afrique centrale (Guide 2)";;"Van Vliet N., Cornelis D., Ratiarison S., Bivigou A., Ampolo A., Tokate F., Sandrin F., Le Bel S., Nguinguiri J-C.";2017-01-01 00:00:00;"10.17528/cifor/006489";"https://www.altmetric.com/details/26716989"
356;1;1900-01-01 00:00:00;2199-12-31 23:59:59;356;"Dairy cultures to improve the quality of traditional dairy products.";;"Wieland, Barbara; Hilali, M. El-Dine; Rischkowsky, Barbara A.";2017-05-01 00:00:00;;"https://www.altmetric.com/details/20308128"
357;1;1900-01-01 00:00:00;2199-12-31 23:59:59;357;"Community-based control of gastro-intestinal tract parasites";;"Wieland, Barbara; Desta, Hiwot; Alemayehu, Gezahegn; Alemu, Biruk";2017-05-01 00:00:00;;"https://www.altmetric.com/details/20308140"
358;1;1900-01-01 00:00:00;2199-12-31 23:59:59;358;"Coenurosis control – break the cycle";;"Wieland, Barbara; Desta, Hiwot; Alemayehu, Gezahegn; Alemu, Biruk";2017-05-01 00:00:00;;"https://www.altmetric.com/details/20103128"
359;1;1900-01-01 00:00:00;2199-12-31 23:59:59;359;"Climate-Smart Agriculture in Nepal: Champion technologies and their pathways for scaling up";;"Chaudhari, Pashupati; Poudel, Bikash; Khatri-Chhetri, Arun; Khanal, Ram Chandra; Bhatta, Kiran";2017-06-27 00:00:00;;"https://www.altmetric.com/details/21453199"
360;1;1900-01-01 00:00:00;2199-12-31 23:59:59;360;"Climate smartness of GIZ soil protection and rehabilitation technologies in Maharashtra, India: Rapid assessment report";;"Sommer, Rolf; Birnholz, Celine; Chandrappagari, Suvarna; Koge, Jessica; Braslow, Juliet";2017-01-01 00:00:00;;"https://www.altmetric.com/details/17597756"
361;1;1900-01-01 00:00:00;2199-12-31 23:59:59;361;"Climate smartness of GIZ soil protection and rehabilitation technologies in Ethiopia: Rapid assessment report";;"Paul, Birthe; Sommer, Rolf; Birnholz, Celine; Snyder, Katherine; Gurmessa, Biyensa; Koge, Jessica; Braslow, Juliet; Notenbaert, An Maria Omer";2017-01-01 00:00:00;;"https://www.altmetric.com/details/17597752"
362;1;1900-01-01 00:00:00;2199-12-31 23:59:59;362;"Building improved market facilities";;"Tesfahun, G.";2017-05-01 00:00:00;;"https://www.altmetric.com/details/20165365"
363;1;1900-01-01 00:00:00;2199-12-31 23:59:59;363;"Better hygienic practices to improve small ruminant meat quality";;"Wieland, Barbara; Rischkowsky, B.; Grace, Delia; Roesel, Kristina";2017-05-01 00:00:00;;"https://www.altmetric.com/details/20047844"
364;1;1900-01-01 00:00:00;2199-12-31 23:59:59;364;"Better hygienic milking practices to improve goat milk quality";;"Wieland, Barbara; Hilali, M. El-Dine; Haile, Aynalem; Grace, Delia; Rischkowsky, Barbara A.; Roesel, Kristina";2017-05-01 00:00:00;;"https://www.altmetric.com/details/20047843"
365;1;1900-01-01 00:00:00;2199-12-31 23:59:59;365;"Assessment of potential CSA options for future agriculture production in the South Central Coast region of Vietnam";;"CGIAR Research Program on Climate Change, Agriculture and Food Security";2017-06-01 00:00:00;;"https://www.altmetric.com/details/20931299"
366;1;1900-01-01 00:00:00;2199-12-31 23:59:59;366;"Assessing sustainability of milk production farm in Tanzania";;"Kurwijila, Lusato; Munyaneza, Celestin; Mdoe, N.S.Y.; Baltenweck, Isabelle; Twine, Edgar";2017-05-23 00:00:00;;"https://www.altmetric.com/details/20854710"
367;1;1900-01-01 00:00:00;2199-12-31 23:59:59;367;"Assessing and strengthening the gender capacities of value chain actors and partners in Ethiopia";;"Mulema, Annet; Kinati, Wole";2017-05-01 00:00:00;;"https://www.altmetric.com/details/20165366"
368;1;1900-01-01 00:00:00;2199-12-31 23:59:59;368;"Analyzing REDD+ as an experiment of transformative climate governance: Insights from Indonesia";"Environmental Science & Policy";"Maharani, Anna Cynthia; Korhonen-Kurki, Kaisa; Moeliono, Moira; Dwisatrio, Bimo";2017-07-01 00:00:00;"10.1016/j.envsci.2017.03.014";"https://www.altmetric.com/details/20363549"
