pk_id_powb_milestone,version,date_from,date_to,id,"pk","title"
1091,1,1900-01-01 00:00:00,2200-01-01 00:00:00,1091,"1091_122","2020 - Series of last mile collaborators actively involved in promotion and scaling of SI products. Reality check on scaling approaches implemented for development actors"
1092,1,1900-01-01 00:00:00,2200-01-01 00:00:00,1092,"1092_122","2020 - Adaptive research improves understanding of gender, youth and adoption, adaptation and scaling-up processes, with focus on market demand as trigger of innovation"
1093,1,1900-01-01 00:00:00,2200-01-01 00:00:00,1093,"1093_122","2020 - 1) Decision support-, mechanization and other tools, processes improve target groups' ability to seize opp's and avoid losses2) Improved understanding of complex interaction between the enabling environment and business propositions for ICT services for scaling up, social networking"
1094,1,1900-01-01 00:00:00,2200-01-01 00:00:00,1094,"1094_118","2020 - Capacity enhancement to improve gender equity in restoration initiatives in at least two countries (Cameroon, Peru, Ethiopia)"
1095,1,1900-01-01 00:00:00,2200-01-01 00:00:00,1095,"1095_118","2020 - National and sub-national gender-responsive strategies for restoration are improved and deliver food security and livelihoods co-benefits, by the better use of local agrobiodiversity in at least three countries (Uganda, Nepal, Uzbekistan)"
1096,1,1900-01-01 00:00:00,2200-01-01 00:00:00,1096,"1096_118","2020 - Stakeholder capacities and information platforms are developed, leading to more feasible, gender-responsive and locally-led restoration projects in productive landscapes in at least 2 countries (Ethiopia, Peru)"
1097,1,1900-01-01 00:00:00,2200-01-01 00:00:00,1097,"1097_118","2020 - Sustainable and socially inclusive models for landscape restoration and sustainable intensification are co-designed with private sector partners in at least two countries (Peru, Kenya)"
1098,1,1900-01-01 00:00:00,2200-01-01 00:00:00,1098,"1098_118","2020 - Policy makers better understand the success and failure factors of restoration efforts, leading to more effective, evidence-driven land restoration projects in Colombia and Ethiopia"
1099,1,1900-01-01 00:00:00,2200-01-01 00:00:00,1099,"1099_118","2020 - Tool developed and utilized by Ethiopian Ministry of Agriculture for ‘sound’ fertilizer recommendation using big data analytics to make informed decisions on integrated soil fertility management in degraded landscapes"
1100,1,1900-01-01 00:00:00,2200-01-01 00:00:00,1100,"1100_118","2020 - Capacity to use soil-plant spectral technology to assess soil health and target land restoration interventions developed in at least five additional countries in Africa (Guinea, The Gambia, Mali, Niger, Senegal, Sierra Leone), Asia (China, India, Vietnam), and Latin America (Haiti), and farm soil testing services extended to farmers through private sector partnerships in Kenya and Ghana."
1101,1,1900-01-01 00:00:00,2200-01-01 00:00:00,1101,"1101_118","2020 - Incorporation of up-to-date and accurate spatial assessments at relevant scales into decision dashboards for enhanced engagement with evidence around land degradation, soil health and land restoration in Kenya"
1102,1,1900-01-01 00:00:00,2200-01-01 00:00:00,1102,"1102_118","2020 - WLE monitoring, evaluation, learning and impact assessment (MELIA) framework and methods, which explicitly considers changes in gender equality and social inclusion, piloted in the context of the Promise of the Commons initiative in at least one state in India"
1103,1,1900-01-01 00:00:00,2200-01-01 00:00:00,1103,"1103_118","2020 - 3-5 sustainable and gender inclusive business models for agriculture, land and water management (ALWM) solutions piloted with the private sector in at least 3 countries (India, Ethiopia, Ghana, Pakistan, Nepal, Bangladesh)."
1104,1,1900-01-01 00:00:00,2200-01-01 00:00:00,1104,"1104_118","2020 - Sustainable and socially inclusive agriculture, land and water management (ALWM) solutions for landscape/ watershed management are integrated in public sector investments in two countries (Ethiopia, India)"
1105,1,1900-01-01 00:00:00,2200-01-01 00:00:00,1105,"1105_118","2020 - National governments combine on-farm and scheme performance tools to improve irrigation efficiency at scheme level in at least 3 countries (India, Zimbabwe, Ethiopia, Myanmar, Sri Lanka, countries in Central Asia)"
1106,1,1900-01-01 00:00:00,2200-01-01 00:00:00,1106,"1106_118","2020 - Recommendations and tools to support inclusive water governance are tested/ implemented by national governments in at least 2 countries (Myanmar, Zimbabwe)"
1107,1,1900-01-01 00:00:00,2200-01-01 00:00:00,1107,"1107_118","2020 - Recommendations for gender sensitive Milan Urban Food Policy Pact (MUFPP) indicators provided to global MUFPP secretariat to inform its works across all 200 signatory cities"
1108,1,1900-01-01 00:00:00,2200-01-01 00:00:00,1108,"1108_118","2020 - Ten towns or cities create Urban Food Policies or Strategies with WLE facilitation, leading to improved food security and resilience in urban areas"
1109,1,1900-01-01 00:00:00,2200-01-01 00:00:00,1109,"1109_118","2020 - In collaboration with Sri Lanka's regulatory agencies, guidelines for organic fertilizer production developed and 100 private sector producers and farmers trained in their use"
1110,1,1900-01-01 00:00:00,2200-01-01 00:00:00,1110,"1110_118","2020 – Roll out of free Resource, Reuse and Recovery (RRR) online course available based on WLE research and publications"
1111,1,1900-01-01 00:00:00,2200-01-01 00:00:00,1111,"1111_118","2020 - The Food and Agriculture Organization (FAO) adopts WLE revised water quality guidelines (starting with Central Asia)"
1112,1,1900-01-01 00:00:00,2200-01-01 00:00:00,1112,"1112_118","2020 - Three new WLE facilitated public-private partnerships (PPP) on waste use for resource recovery operating in Ghana supporting alternative options for increased food and energy production"
1113,1,1900-01-01 00:00:00,2200-01-01 00:00:00,1113,"1113_118","2020 - Enhanced awareness and increased capacity within government, NGOs and private sector (in India, Nepal, Bangladesh, Myanmar) to better manage gendered vulnerabilities in marginalized farming communities, associated with climate hazards and unequal access to resources."
1114,1,1900-01-01 00:00:00,2200-01-01 00:00:00,1114,"1114_118","2020 - Tested WLE gender-responsive solutions for mitigation of, and adaptation to, flood and drought risks (including nature based solutions, insurance, pre-event forecasting and post-event monitoring), where possible bundled with complementary solutions from other CRPs (e.g. fisheries and seed options) to enhance adaptive capacity and build resilience to multiple climate risks, further along the pathway to scaling in at least 5 countries (India, Myanmar, Nepal, Vietnam, Sri Lanka)"
1115,1,1900-01-01 00:00:00,2200-01-01 00:00:00,1115,"1115_118","2020 - At least 1 multilateral agency (Asian Development Bank) and 1 River Basin Organization (Mekong River Basin Commission) and 2 regional programs (Nile Equatorial Lakes Subsidiary Action Program and Southern African Development Community) invest in further development and capacity building of WLE approaches and tools (e.g. Water Accounting Framework; e-flows simulation; groundwater management) that facilitate greater understanding of inter-sectoral trade-offs associated with different water management options."
1116,1,1900-01-01 00:00:00,2200-01-01 00:00:00,1116,"1116_118","2020 - At least one government (Ethiopia) in Sub-Saharan Africa uses energy tools to inform national investment plans for electrification while also considering irrigation development plans."
1117,1,1900-01-01 00:00:00,2200-01-01 00:00:00,1117,"1117_118","2020 - A gender-responsive interactive roadmap on WLE landscape decision-support tools is co-developed with decision-makers from at least 3 countries (Ethiopia, Uganda, Rwanda) and is made available online"
1118,1,1900-01-01 00:00:00,2200-01-01 00:00:00,1118,"1118_118","2020 - Commission on Sustainable Agricultural Intensification launched with strong Southern engagement, and dialogues conducted during at least 2 high-level events."
1119,1,1900-01-01 00:00:00,2200-01-01 00:00:00,1119,"1119_118","2020 - Gender-responsive WLE landscape decision support tools are demonstrated at 2 international events and adopted by key partners (national and local governments, Food and Land Use Coalition and other major international fora) to facilitate co-learning"
1120,1,1900-01-01 00:00:00,2200-01-01 00:00:00,1120,"1120_118","2020 - Researchers and decision-makers from at least 10 institutions are trained on how to better bridge evidence and decision-makers related to sustainable agricultural landscapes and natural resource management"
1121,1,1900-01-01 00:00:00,2200-01-01 00:00:00,1121,"1121_118","2020 - The use of WLE decision support tools in at least 3 agricultural or natural resource management programs, supports trade-off and risk-return analysis and contributes to the identification and implementation of sustainable and inclusive options"
1122,1,1900-01-01 00:00:00,2200-01-01 00:00:00,1122,"1122_2","None for 2017"
1123,1,1900-01-01 00:00:00,2200-01-01 00:00:00,1123,"1123_2","At least 2 partners, including value chain actors, participate in the identification and design of at least 2 gender-sensitive interventions aligned with findings from CoA1 to improve diets in Ethiopia and Vietnam"
1124,1,1900-01-01 00:00:00,2200-01-01 00:00:00,1124,"1124_2","None for 2017"
1125,1,1900-01-01 00:00:00,2200-01-01 00:00:00,1125,"1125_2","All 8 target countries release second-wave of tier 1 crops"
1126,1,1900-01-01 00:00:00,2200-01-01 00:00:00,1126,"1126_2","5 CGIAR centers develop a work plan and strategy in collaboration with HarvestPlus to operationalize 2014 commitment to mainstreaming"
1127,1,1900-01-01 00:00:00,2200-01-01 00:00:00,1127,"1127_2","6.5 million HHs growing and consuming biofortified crops (6 million in target countries, 0.5 million in partnership countries)"
1128,1,1900-01-01 00:00:00,2200-01-01 00:00:00,1128,"1128_2","Ex ante impact and cost-effectiveness of biofortification and biofortification interventions are considered by national and international investors"
1129,1,1900-01-01 00:00:00,2200-01-01 00:00:00,1129,"1129_2","Evidence on the impact of delivery programs on farmer adoption of iron beans in Rwanda and vitamin A maize in Zambia influence HarvestPlus and other programs’ delivery of biofortified crops"
1130,1,1900-01-01 00:00:00,2200-01-01 00:00:00,1130,"1130_2","The revised biofortification priority index (BPI 2.0) is are available to partners for informing decisions on investing in implementing and evaluating biofortification projects"
1131,1,1900-01-01 00:00:00,2200-01-01 00:00:00,1131,"1131_2","Biofortification is included in at least two additional global, regional or national strategies and/or policies"
1132,1,1900-01-01 00:00:00,2200-01-01 00:00:00,1132,"1132_2","National partners in at least 2 countries (Vietnam + TBD) engaged in review process on food safety in informal markets (which includes gender and equity aspects)"
1133,1,1900-01-01 00:00:00,2200-01-01 00:00:00,1133,"1133_2","1-2 CRP value chains for animal-source foods and/or produce identified for scaling up and out using incentive and market based approaches, coordinated with CRP Livestock, CRP Fish and others"
1134,1,1900-01-01 00:00:00,2200-01-01 00:00:00,1134,"1134_2","39,000 farmers use biocontrol across 8 countries in Sub Saharan Africa"
1135,1,1900-01-01 00:00:00,2200-01-01 00:00:00,1135,"1135_2","None in 2017  "
1136,1,1900-01-01 00:00:00,2200-01-01 00:00:00,1136,"1136_2","In collaboration with program implementers, evidence and evaluation tools developed in Phase I are used to develop proposals for assessing different nutrition- and gender-sensitive programs in 2 countries (to be determined in consultation with programme partner (WFP) in 2017), each with a rigorous evaluation component included"
1137,1,1900-01-01 00:00:00,2200-01-01 00:00:00,1137,"1137_2","FP4 researchers and stakeholders work with SUN Secretariat to map and analyze current cross-sectoral nutrition-sensitive discourse and context to identify 3 researchable challenges for SUN policy support"
1138,1,1900-01-01 00:00:00,2200-01-01 00:00:00,1138,"1138_2","National policymakers and shapers, and stakeholders from different sectors, civil society and industry engage in policy environment analysis/stories of change in 7 focal countries: Bangladesh, Ethiopia, India (state level), Nepal, Tanzania, Vietnam, and Zambia   "
1139,1,1900-01-01 00:00:00,2200-01-01 00:00:00,1139,"1139_2","3 key capacity gaps identified through engagement with key partners from SUN, CAADP, and others in identified pathways at national, regional, international and subnational levels and cross-CRP to guide flagship capacity strengthening agenda and shape regional events in 2018"
1140,1,1900-01-01 00:00:00,2200-01-01 00:00:00,1140,"1140_2","Key areas of potential research collaboration identified and project underway to compare geospatial changes in agriculture and vector borne disease in Africa"
1141,1,1900-01-01 00:00:00,2200-01-01 00:00:00,1141,"1141_2","Rice researchers demonstrate interest in measuring mosquito productivity as well as rice productivity and collaborations established to integrate mosquito monitoring into rice data collection"
1142,1,1900-01-01 00:00:00,2200-01-01 00:00:00,1142,"1142_2","Serum and DNA bank marketed to the regional research community"
1143,1,1900-01-01 00:00:00,2200-01-01 00:00:00,1143,"1143_2","Inclusion of cysticercosis control targeting livestock in the neglected tropical disease control agenda at national scale"
1144,1,1900-01-01 00:00:00,2200-01-01 00:00:00,1144,"1144_2","Policy documents supported by peer reviewed publications that have a demonstrable change on disease control policy at national or sub-national scale."
1145,1,1900-01-01 00:00:00,2200-01-01 00:00:00,1145,"1145_2","15 national level decision makers made aware of antimicrobial drug use patterns in livestock keeping systems and the impact on resistance"
1146,1,1900-01-01 00:00:00,2200-01-01 00:00:00,1146,"1146_2","At least 10 research organizations representing natural and social scientists from health and agriculture participate in theme-based workshops which recognize gender and equity issues, and build on partnerships identified in 2015 A4NH regional consultations"
1147,1,1900-01-01 00:00:00,2200-01-01 00:00:00,1147,"1147_408","1.1.1. Key data and analytics needs identified through consultations via existing meetings involving CGIAR and external stakeholders"
1148,1,1900-01-01 00:00:00,2200-01-01 00:00:00,1148,"1148_408","1.1.2. Stakeholder-responsive roster of 3-5 top data analytics solutions developed, to be hosted on BIG DATA’s infrastructure “Toolkit”"
1149,1,1900-01-01 00:00:00,2200-01-01 00:00:00,1149,"1149_408","1.1.3. Key enabling backend services and tools (e.g., Raster Data Catalog and Analysis Tool, R Studio, Sphinx etc.) identified and implemented through the BIG DATA infrastructure   "
1150,1,1900-01-01 00:00:00,2200-01-01 00:00:00,1150,"1150_408","1.2.1. Dataset prioritization framework developed consultatively and implemented to identify high-value low-risk, low-cost datasets"
1151,1,1900-01-01 00:00:00,2200-01-01 00:00:00,1151,"1151_408","1.2.2. Data quality assurance criteria and exemplar workflows developed"
1152,1,1900-01-01 00:00:00,2200-01-01 00:00:00,1152,"1152_408","1.2.3. 20% increase in uploads of well-annotated current and key legacy datasets to appropriate institutional repositories"
1153,1,1900-01-01 00:00:00,2200-01-01 00:00:00,1153,"1153_408","1.3.1. Scope of work for harvesting CGIAR publications and data developed, including: user requirements, inter-linking and harvesting of institutional data and publications repositories and planning/reporting platforms (e.g. MARLO), and acceptable budget range"
1154,1,1900-01-01 00:00:00,2200-01-01 00:00:00,1154,"1154_408","1.3.2. Criteria and process for choosing appropriate developer/s of harvester articulated and implemented as a consultative process – including key partners, SC, and IAB "
1155,1,1900-01-01 00:00:00,2200-01-01 00:00:00,1155,"1155_408","1.3.3. Service provider for the development of Harvester identified; an early working prototype developed"
1156,1,1900-01-01 00:00:00,2200-01-01 00:00:00,1156,"1156_408","1.4.1. CGIAR Core metadata schema implemented and/or mapped across key publications and data repositories of all 15 Centers; Agronomy Ontology completed and prototype field book tested; Crop Ontology terms adopted as descriptors by at least 6 key repositories; draft for key classes and sub-classes for socioeconomic ontology developed; links to agrisemantics efforts external to CGIAR maintained"
1157,1,1900-01-01 00:00:00,2200-01-01 00:00:00,1157,"1157_408","1.4.2. Materials developed and shared with appropriate CGIAR communities of practice on standards and ontologies to advocate for best practices and adoption"
1158,1,1900-01-01 00:00:00,2200-01-01 00:00:00,1158,"1158_408","1.4.3. At least one workshop/training for data/repository managers and ontologists held on semantic standards to render datasets accessible"
1159,1,1900-01-01 00:00:00,2200-01-01 00:00:00,1159,"1159_408","2.1.1. Fully establish five Communities of Practice around topics of geospatial data, economic data, ontologies, data-driven agronomy and crop modelling"
1160,1,1900-01-01 00:00:00,2200-01-01 00:00:00,1160,"1160_408","2.1.2. Identify high priority, high impact new data products and develop methodological plan to produce them, with initial implementation"
1161,1,1900-01-01 00:00:00,2200-01-01 00:00:00,1161,"1161_408","2.1.3. Map out CGIAR needs for common big data related computing and storage infrastructure.  Establish shared service for CGIAR by negotiating with external data utility partners."
1162,1,1900-01-01 00:00:00,2200-01-01 00:00:00,1162,"1162_408","2.2.1. Hold high-level Convention on Big Data in Agriculture, with wide participation of CGIAR and non-CGIAR actors, establishment of collaborative agreements"
1163,1,1900-01-01 00:00:00,2200-01-01 00:00:00,1163,"1163_408","3.1.1. 5 Inspire projects selected, generating innovative, data-driven solutions to CGIAR research and development problems"
1164,1,1900-01-01 00:00:00,2200-01-01 00:00:00,1164,"1164_1","1.1.1 New generation of multi-level CCAFS scenarios methodology developed and tested, including combined climate and socio-economic scenarios with a focus on food and nutrition security and gender and social inclusion gaming approaches for youth are explored"
1165,1,1900-01-01 00:00:00,2200-01-01 00:00:00,1165,"1165_1","1.1.2 CCAFS regional scenarios are used for multilevel policy development and implementation in selected countries/states, focusing on climate and food and nutrition security policies aimed at dietary diversity"
1166,1,1900-01-01 00:00:00,2200-01-01 00:00:00,1166,"1166_1","1.2.1 2 modified versions of global and regional models to evaluate climate-smart practices and technologies and the related trade-offs and synergies for CSA are developed and tested"
1167,1,1900-01-01 00:00:00,2200-01-01 00:00:00,1167,"1167_1","1.2.2 Cross-CRP modes of operation are defined, including joint ex ante analyses and data sharing and the CoA 1.1 Learning Platform established"
1168,1,1900-01-01 00:00:00,2200-01-01 00:00:00,1168,"1168_1","1.3.1 Novel analytical frameworks, indicators and metrics for evaluating cross-level dynamics and the effectiveness of enabling policy environments to support adaptation options and the scaling of CSA are developed and tested, considering 'good enough' governance"
1169,1,1900-01-01 00:00:00,2200-01-01 00:00:00,1169,"1169_1","1.3.2 Science-policy exchange processes, stakeholder fora and learning alliances are maintained and create conditions for open policy dialogue draft guidelines for mainstreaming climate change adaptation and climate-smart practices in agriculture and other sectors and at different administrative levels are disseminated"
1170,1,1900-01-01 00:00:00,2200-01-01 00:00:00,1170,"1170_1","1.4.1 Comparative analysis completed of enabling policy environments (especially food and nutrition security policies) with respect to gender equity considerations and recommendations for strengthened gender and social inclusion in enhanced enabling policy environments"
1171,1,1900-01-01 00:00:00,2200-01-01 00:00:00,1171,"1171_1","1.5.1 Training materials developed and workshops held to strengthen partner capacity in applying decision support tools in targeting, priority setting, policy/investment decision making capacities and articulating national priorities in global fora; national planners are supported in utilising CCAFS information in policy decisions and investment plans through science-policy platforms and processes"
1172,1,1900-01-01 00:00:00,2200-01-01 00:00:00,1172,"1172_1","2.1.1 Synthesis reports on local-level enabling environment, incentives and subnational policies and plans (LAPAS) supporting CSA investment and enhanced adoption "
1173,1,1900-01-01 00:00:00,2200-01-01 00:00:00,1173,"1173_1","2.1.2 Lessons learned and knowledge products to overcome barriers to investment and further adoption constraints at local scales"
1174,1,1900-01-01 00:00:00,2200-01-01 00:00:00,1174,"1174_1","2.2.1 A short list of CSA technologies, practices/services with good potentials for business case (incl. Business model for small ruminant value chain) in SA and EA Business plan developed and validated in three SA CSVs business model for water storage options, including alternative investments options tested in WA."
1175,1,1900-01-01 00:00:00,2200-01-01 00:00:00,1175,"1175_1","2.2.2 2 pilots of widespread use of CSA practices in voluntary certification schemes (cocoa or coffee value chains) and testing of innovative financial mechanisms."
1176,1,1900-01-01 00:00:00,2200-01-01 00:00:00,1176,"1176_1","2.3.1 10 promising climate-smart water, crop-livestock-agroforestry practices and 5 value chains prioritized, tested and adapted in CSVs in 12 countries.  "
1177,1,1900-01-01 00:00:00,2200-01-01 00:00:00,1177,"1177_1","2.3.2 Framework developed and validated to-design, test and monitor transformative CSA crop-livestock-tree gender sensitive practices. Standardized data capture (climate, soil and management information) and Cost- effectiveness assessed at site-specific level. Common analytical protocols and case studies developed for evaluating socially disaggregated CSA options benefits on productivity, adaptation and mitigation (with FP3)."
1178,1,1900-01-01 00:00:00,2200-01-01 00:00:00,1178,"1178_1","2.4.1 Gender tailored CSA portfolios and business cases identified for testing with local partners in CSVs."
1179,1,1900-01-01 00:00:00,2200-01-01 00:00:00,1179,"1179_1","2.4.2 Gender disaggregated impact of CSA technologies and practices evaluated in CSVs Framework, methods and approaches developed to co-design, test and monitor transformative gender focused options."
1180,1,1900-01-01 00:00:00,2200-01-01 00:00:00,1180,"1180_1","2.5.1 Diagnosis on subnational policy and institutional frameworks analysis focusing on different options that can support the adoption of preferred CSA practices"
1181,1,1900-01-01 00:00:00,2200-01-01 00:00:00,1181,"1181_1","2.5.2 CSA knowledge products made available for partners including at least 10 new CSA country profiles, new national CSA prioritization processes, and Climate Wizard updated."
1182,1,1900-01-01 00:00:00,2200-01-01 00:00:00,1182,"1182_1","3.1.1 Network of trial sites for more efficient management options for fertilizer, feed, water, and land use in 5-8 countries"
1183,1,1900-01-01 00:00:00,2200-01-01 00:00:00,1183,"1183_1","3.1.2 Identification of food loss and waste (FLW) opportunities for LED and commercially viable interventions in priority product value chains"
1184,1,1900-01-01 00:00:00,2200-01-01 00:00:00,1184,"1184_1","3.2.1 Framework for institutional innovation and monitoring to enhance performance of cattle farming in Brazil"
1185,1,1900-01-01 00:00:00,2200-01-01 00:00:00,1185,"1185_1","3.3.1 Analysis supporting more ambitious INDC targets and resource guide to LED available to investors, donors and country partners with analysis including gender implications"
1186,1,1900-01-01 00:00:00,2200-01-01 00:00:00,1186,"1186_1","3.3.2 Improved emission factors and estimation methods for smallholder emissions, for incorporation into LED planning and prioritization tools"
1187,1,1900-01-01 00:00:00,2200-01-01 00:00:00,1187,"1187_1","3.3.3 Mitigation hotspots and priorities by sector and country in 5-8 countries"
1188,1,1900-01-01 00:00:00,2200-01-01 00:00:00,1188,"1188_1","3.4.1 Gender-disaggregated data on social factors influencing uptake of LED practices for rice and livestock"
1189,1,1900-01-01 00:00:00,2200-01-01 00:00:00,1189,"1189_1","3.5.1 Flagship knowledge products made available for partners including Mitigation Option Tool, online mitigation compendium, primer on LED in agriculture, smallholder emissions estimation platform with training materials and emission factors (SAMPLES) "
1190,1,1900-01-01 00:00:00,2200-01-01 00:00:00,1190,"1190_1","3.5.2 Agricultural LED readiness indicators available"
1191,1,1900-01-01 00:00:00,2200-01-01 00:00:00,1191,"1191_1","4.1.1 Flood insurance theoretical and institutional framework, tools, community of practice, public-private partnership model and analysis of scaling potential in SA. "
1192,1,1900-01-01 00:00:00,2200-01-01 00:00:00,1192,"1192_1","4.1.2 Evidence from existing insurance initiatives, capacity development, piloting, and analysis of scaling potential for insurance linked to credit and inputs in EA and WA. "
