pk_id_deliverables_info,version,date_from,date_to,deliv_id,"title","description","deliverable_type","dissemination_URL","DOI"
351,1,1900-01-01 00:00:00,2200-01-01 00:00:00,13526,"5 universities/colleges demanding/using RRR curriculum","Planned for December 2019","Lecture/Training Course Material",,
352,1,1900-01-01 00:00:00,2200-01-01 00:00:00,13527,"CRFS Indicator Report in Nairobi from Mazingira","$23364 given to Mazingira to develop indicators. ","Discussion paper/Working paper/White paper",,
353,1,1900-01-01 00:00:00,2200-01-01 00:00:00,13560,"Effects of agricultural mechanization on economies of scope in crop production in Nigeria","Formerly titled ""Effects of agricultural mechanization on agricultural specialization and diversification""","Journal Article (peer reviewed)","http://ebrary.ifpri.org/cdm/ref/collection/p15738coll5/id/6909",
354,1,1900-01-01 00:00:00,2200-01-01 00:00:00,13761,"Measuring employment in the agri-food system: Existing data and directions for future research","with contribution from 6.2.2","Factsheet, Project Note","http://ebrary.ifpri.org/cdm/ref/collection/p15738coll2/id/133542",
355,1,1900-01-01 00:00:00,2200-01-01 00:00:00,13768,"Insights: Horizontal Scaling of Innovations through National Community Seed Bank Networking","An initial assessment of how some of the most demanded community seedbank varieties and related knowledge/practice spread horizontally through networking","Factsheet, Project Note",,
356,1,1900-01-01 00:00:00,2200-01-01 00:00:00,13784,"Building and sustaining multi-stakeholder platforms for natural resource governance: Lessons from eight landscape-level cases","N/A","Conference paper / Seminar paper",,
357,1,1900-01-01 00:00:00,2200-01-01 00:00:00,13785,"Multi-actor platform (MAP) Design Guide","N/A","Presentation/Poster",,
358,1,1900-01-01 00:00:00,2200-01-01 00:00:00,13793,"JAL SUTRA game","Open Access User-friendly Mobile Application Tools for Capacity Development in India. User friendly mobile application tools to facilitate experiment based capacity development interventions are open accessible.","Data portal/Tool/Model code/Computer software","https://play.google.com/store/apps/details?id=org.measure.gameapp",
359,1,1900-01-01 00:00:00,2200-01-01 00:00:00,13826,"Best-bet Options for Tropical Forest Conservation and Livelihoods Development: Evidence from Petén, Guatemala ","Best-bet options for ensuring tropical forest conservation and livelihoods development: Evidence from the community forest concessions in Petén, Guatemala (led by ICRAF, with contributions from CIFOR)","Journal Article (peer reviewed)",,
360,1,1900-01-01 00:00:00,2200-01-01 00:00:00,13827,"A territorial based Human Development Index report for the Northern Strip including Petén (joint report with UNDP).","The political economy of the Maya Biosphere Reserve: Options for reconciling diverse stakeholder interests with community needs in the Maya Biosphere Reserve in Petén, Guatemala","Policy workshop/Dialogue report",,
361,1,1900-01-01 00:00:00,2200-01-01 00:00:00,13854,"Design and rating of risk-contingent credit for balancing business and financial risks for Kenyan farmers","r&r applied economics - applied financial economics","Journal Article (peer reviewed)","http://cdm15738.contentdm.oclc.org/cdm/ref/collection/p15738coll5/id/6681",
362,1,1900-01-01 00:00:00,2200-01-01 00:00:00,13856," RISK - CONTINGENT CREDIT (RCC) POLICY SCHEDULE 2019: Tool/sheet for risk-contingent credit rating and simulation for banking and insurance partners","Tool is complete and being used by partners. Will not be published separately from future  article","Data portal/Tool/Model code/Computer software",,
363,1,1900-01-01 00:00:00,2200-01-01 00:00:00,13876,"(Un)making the Upland: Resettlement, Rubber and Land Use Planning in Laos","N/A","Journal Article (peer reviewed)",,
364,1,1900-01-01 00:00:00,2200-01-01 00:00:00,13884,"Participatory Rangeland Management ","Changes in land access, use or ownership which might be due to land reform with new policy and legislation developments or project or an intervention (implementation of participatory rangeland management in Ethiopia or village land use planning in Tanzania), or due to socio-economic and cultural change. ","User manual/Technical Guide",,
365,1,1900-01-01 00:00:00,2200-01-01 00:00:00,13885,"Linking Land Tenure Security with Food Security: Unpacking Farm Households’ Perceptions in the Rural Upland of Laos","N/A","Journal Article (peer reviewed)","http://ebrary.ifpri.org/cdm/ref/collection/p15738coll9/id/565",
366,1,1900-01-01 00:00:00,2200-01-01 00:00:00,13905,"Women, irrigation and social norms in Egypt: ‘The more things change, the more they stay the same?'","Women, irrigation and social norms in Egypt: ‘The more things change, the more they stay the same?'","Journal Article (peer reviewed)","http://ebrary.ifpri.org/cdm/ref/collection/p15738coll9/id/562",
367,1,1900-01-01 00:00:00,2200-01-01 00:00:00,13918,"Accelerating technical change through video-mediated agricultural extension: Evidence from Ethiopia","Accelerating technical change through video-mediated agricultural extension: Evidence from Ethiopia
","Discussion paper/Working paper/White paper","http://ebrary.ifpri.org/cdm/ref/collection/p15738coll2/id/133323",
368,1,1900-01-01 00:00:00,2200-01-01 00:00:00,13919,"Accelerating technical change through video-mediated agricultural extension: Evidence from Ethiopia","Accelerating technical change through video-mediated agricultural extension: Evidence from Ethiopia
","Journal Article (peer reviewed)",,
369,1,1900-01-01 00:00:00,2200-01-01 00:00:00,13920,"Accelerating technical change through video-mediated agricultural extension: Evidence from Ethiopia","Accelerating technical change through video-mediated agricultural extension: Evidence from Ethiopia
","Database/Dataset/Data documentation",,
370,1,1900-01-01 00:00:00,2200-01-01 00:00:00,13921,"Accelerating technical change through video-mediated agricultural extension: Evidence from Ethiopia","Accelerating technical change through video-mediated agricultural extension: Evidence from Ethiopia
","Policy brief/policy note/briefing paper",,
371,1,1900-01-01 00:00:00,2200-01-01 00:00:00,13976,"Taking stock models for participatory area-based biodiversity conservation ","Towards New Equitable and Participatory Public and Private Models for Biodiversity Conservation Program. A report using detailed case studies on the above and the key requirements, enabling environments and characteristics needed for success through application of various approaches, accessed through an interactive map-based interface. ","Funder report",,
372,1,1900-01-01 00:00:00,2200-01-01 00:00:00,13982,"The second National Workshop on Development of Ethiopian Food-Based Dietary Guidelines;","Develop Technical Recommendations and Translate them into Public Messages","Research workshop report","https://cgiar.sharepoint.com/sites/IFPRI/A4NH/Flagship%201%20Food%20Systems%20for%20Healthier%20Diets/Forms/AllItems.aspx?id=%2Fsites%2FIFPRI%2FA4NH%2FFlagship%201%20Food%20Systems%20for%20Healthier%20Diets%2FDeliverables%202019%2F%5FWUR%20Deliverables%202019%2FD13982%20FBDGs%20workshop%20report%5FFinal%2Epdf&viewid=00000000%2D0000%2D0000%2D0000%2D000000000000&parent=%2Fsites%2FIFPRI%2FA4NH%2FFlagship%201%20Food%20Systems%20for%20Healthier%20Diets%2FDeliverables%202019%2F%5FWUR%20Deliverables%202019",
373,1,1900-01-01 00:00:00,2200-01-01 00:00:00,14028,"PM2A - Burundi impact results","not required","Journal Article (peer reviewed)","http://ebrary.ifpri.org/cdm/singleitem/collection/p15738coll5/id/6737/rec/2",
374,1,1900-01-01 00:00:00,2200-01-01 00:00:00,14029,"PM2A - Guatemala impact results","PROCOMIDA, a food-assisted maternal and child health and nutrition program contributes to postpartum weight retention in Guatemala: a cluster-randomized controlled intervention trial","Journal Article (peer reviewed)","http://ebrary.ifpri.org/cdm/ref/collection/p15738coll5/id/6782",
375,1,1900-01-01 00:00:00,2200-01-01 00:00:00,14030,"PM2A - The cost of improving nutritional outcomes in Burundi and Guatemala","N/A","Journal Article (peer reviewed)","http://ebrary.ifpri.org/cdm/singleitem/collection/p15738coll5/id/6704/rec/1",
376,1,1900-01-01 00:00:00,2200-01-01 00:00:00,14031,"PM2A - additional impact results from Burundi","The impact of Tubaramure, a food-assisted maternal and child health and nutrition program in Burundi on household food security, consumption, hunger and dietary diversity, and on maternal dietary diversity and child complementary feeding practices: a cluster-randomized controlled trial. https://doi.org/10.1093/jn/nxz295","Journal Article (peer reviewed)","http://ebrary.ifpri.org/cdm/ref/collection/p15738coll5/id/7028",
377,1,1900-01-01 00:00:00,2200-01-01 00:00:00,14032,"Women's Land Tenure Security: A Conceptual Framework ","Not reported in AR 2018 hence being reported in AR 2019 ","Other Capacity","https://consortium.resourceequity.org/wp-content/uploads/2018/06/CF-FINAL-2018.pdf",
378,1,1900-01-01 00:00:00,2200-01-01 00:00:00,14049,"Appropriate use of linear growth measures ","N/A","Journal Article (peer reviewed)","http://ebrary.ifpri.org/cdm/singleitem/collection/p15738coll5/id/6604/rec/6",
379,1,1900-01-01 00:00:00,2200-01-01 00:00:00,14050,"A different focus on stunting","N/A","Blog","http://ebrary.ifpri.org/cdm/singleitem/collection/p15738coll16/id/1130/rec/17",
380,1,1900-01-01 00:00:00,2200-01-01 00:00:00,14079,"IFAD Phase II: Uganda - SBCC Guidance/Strategy for Nutrition in Ag Investment Projects","N/A","Guidebook/Handbook/Good Practice Note","https://cgiar.sharepoint.com/sites/IFPRI/A4NH/Flagship%204/Forms/AllItems.aspx?id=%2Fsites%2FIFPRI%2FA4NH%2FFlagship%204%2F2019%20deliverables%2F%5FBIOV%20Deliverables%202019%2FD14079%5FNutrition%20SBCC%20Strategy%2Epdf&parent=%2Fsites%2FIFPRI%2FA4NH%2FFlagship%204%2F2019%20deliverables%2F%5FBIOV%20Deliverables%202019&p=true&originalPath=aHR0cHM6Ly9jZ2lhci5zaGFyZXBvaW50LmNvbS86Yjovcy9JRlBSSS9BNE5IL0VaVlB4REQ2N0g1Q210ZkRuclFWY0M0Ql9wM1Y4emJIMGRWNFNISlNpR0x1R1E_cnRpbWU9SnBIQXg4NjIxMGc",
381,1,1900-01-01 00:00:00,2200-01-01 00:00:00,14081,"IFAD Phase II: Uganda - Training manual for household mentors, community-based facilitators and community development officers to use nutrition-SBCC in ag projects","N/A","User manual/Technical Guide","https://cgiar.sharepoint.com/sites/IFPRI/A4NH/Flagship%204/Forms/AllItems.aspx?csf=1&e=RXOaMW&cid=ab389e6b%2D6719%2D4663%2D88cf%2D047c05ce329a&RootFolder=%2Fsites%2FIFPRI%2FA4NH%2FFlagship%204%2F2019%20deliverables%2F%5FBIOV%20Deliverables%202019%2FD14081&FolderCTID=0x012000CD250C4E5DE72745953C55CB2FAC81B9",
382,1,1900-01-01 00:00:00,2200-01-01 00:00:00,14111,"Cash, food, and vouchers reduce intimate partner violence in urban areas in Ecuador","Cash, food, and vouchers reduce intimate partner violence in urban areas in Ecuador","Policy brief/policy note/briefing paper","http://ebrary.ifpri.org/cdm/ref/collection/p15738coll2/id/133160",
383,1,1900-01-01 00:00:00,2200-01-01 00:00:00,14112,"Food and cash transfers coupled with nutrition behavior change communication lead to sustained reductions in intimate partner violence in Bangladesh","Food and cash transfers coupled with nutrition behavior change communication lead to sustained reductions in intimate partner violence in Bangladesh","Policy brief/policy note/briefing paper","http://ebrary.ifpri.org/cdm/ref/collection/p15738coll2/id/133158",
384,1,1900-01-01 00:00:00,2200-01-01 00:00:00,14113,"Cash transfers and intimate partner violence: What does the evidence say?","Cash transfers and intimate partner violence: What does the evidence say?","Infographic","http://ebrary.ifpri.org/cdm/ref/collection/p15738coll2/id/133155",
385,1,1900-01-01 00:00:00,2200-01-01 00:00:00,14121,"Digital Tools for Better Rural Investments: The Agricultural Investment Data Analyzer","Digital Tools for Better Rural Investments: The Agricultural Investment Data Analyzer","Presentation/Poster","https://www.ifpri.org/event/digital-tools-better-rural-investments-agricultural-investment-data-analyzer",
386,1,1900-01-01 00:00:00,2200-01-01 00:00:00,14122,"The policy making process and its stages: introducing the Kaleidoscope Model for food security policy analysis","The policy making process and its stages: introducing the Kaleidoscope Model for food security policy analysis","Book chapter","http://ebrary.ifpri.org/cdm/ref/collection/p15738coll5/id/6981",
387,1,1900-01-01 00:00:00,2200-01-01 00:00:00,14123,"Do Community Seed Banks Contribute to the Social-Ecological Resilience of Communities? A Case Study from Western Guatemala","An analysis of the impact of community seed banks using social-ecological resilience theory.","Journal Article (peer reviewed)",,
388,1,1900-01-01 00:00:00,2200-01-01 00:00:00,14138,"Lessons learned on delivery of biofortified crops in countries 2: Lessons learned developed on the biofortification value chain (in particular, delivery) in Rwanda, Nigeria, Uganda","Uganda has been prioritized in 2020; replaced Bangladesh (which was noted earlier as a focus country for 2020) with Uganda.","Funder report",,
389,1,1900-01-01 00:00:00,2200-01-01 00:00:00,14177,"Registration of Aflasafe products in Malawi","n/a","Discussion paper/Working paper/White paper",,
390,1,1900-01-01 00:00:00,2200-01-01 00:00:00,14178,"Registration of Aflasafe products in Mozambique","2019 note from PMU: Dissemination link points to the registration certificates saved in TeamSpace. ","Concept note","https://cgiar.sharepoint.com/:f:/r/sites/IFPRI/A4NH/Flagship%203/2019%20deliverables/D14158%20Registration%20Aflasafe%20Mozambique?csf=1&e=wOIE5a",
391,1,1900-01-01 00:00:00,2200-01-01 00:00:00,14180,"Report on Aflasafe production using dry inoculum","n/a","Funder report",,
392,1,1900-01-01 00:00:00,2200-01-01 00:00:00,14204,"BFN Species database","Collection of all the national data produced by Brazil, Kenya, Sri Lanka and Turkey under the BFN project with links from the species to recipes","Database/Dataset/Data documentation","http://www.b4fn.org/resources/species-database/",
393,1,1900-01-01 00:00:00,2200-01-01 00:00:00,14271,"Technical Assistance for Developing Operational Guidelines for Biofortification of Staple Food Crops","The aim is to improve the quality of the guidelines on biofortification in Tanzania.","Guidebook/Handbook/Good Practice Note",,
394,1,1900-01-01 00:00:00,2200-01-01 00:00:00,14314,"Blog post on innovations paper","Blog post on innovations paper","Blog","http://a4nh.cgiar.org/2019/04/24/food-systems-innovations-for-healthier-diets/",
395,1,1900-01-01 00:00:00,2200-01-01 00:00:00,14342," Responding to conflict: Does “Cash Plus” work for preventing malnutrition? New evidence from an impact evaluation of Yemen’s Cash for Nutrition Program ","An impact evaluation of Yemen’s Cash for Nutrition program provides new evidence of the benefits of “cash plus” transfer programs to meet nutritional needs in conflict situations.  This deliverable has also been supported by Flagship 2 country program project in Yemen. ","Policy brief/policy note/briefing paper","http://ebrary.ifpri.org/cdm/ref/collection/p15738coll2/id/133205",
396,1,1900-01-01 00:00:00,2200-01-01 00:00:00,14343,"The cash for nutrition intervention in Yemen: Impact evaluation study","Evaluation study that examines the program’s impacts on child nutrition indicators and related intermediate variables during a period of conflict.  This deliverable has also been supported by Flagship 2 country program project in Yemen.","Discussion paper/Working paper/White paper","http://ebrary.ifpri.org/cdm/ref/collection/p15738coll2/id/133219",
397,1,1900-01-01 00:00:00,2200-01-01 00:00:00,14584,"Effect of rice varitey and moisture content on popped rice (pop-rice) characteristics","MC% and amylose content among Thai indica varieties were investigated for popping phenomenon, include popping shape and volume expansion.","Conference paper / Seminar paper",,
398,1,1900-01-01 00:00:00,2200-01-01 00:00:00,14593,"Pop-rice; old but new rice utilization technology for Africa","Review the pop-rice technology development with high-speed camera observation.","Conference paper / Seminar paper",,
399,1,1900-01-01 00:00:00,2200-01-01 00:00:00,14594,"A comparison of composition (nutrient and other substances) of pop, brown and milled rice; pop-rice as a whole grain product","Major- and minor- nutrients were analyzed in pop, brown, and milled rice in 3 varieties in Thailand. Pop-rice was superior in nutrient value as whole grain product.","Conference paper / Seminar paper",,
400,1,1900-01-01 00:00:00,2200-01-01 00:00:00,14595,"Elucidation on rolling of Kuai Chap; Thai traditional rice flake","Thai traditional rice flake, which change their shape to roll during cooking was studied and established model preparation which also conserve changing their shape to roll. And further investigation showed heating direction was found as shape changes from flake to roll during boiling process. ","Conference paper / Seminar paper",,
401,1,1900-01-01 00:00:00,2200-01-01 00:00:00,16715,"Factsheet on identification and characterization of key tree species to reduce land degradation","Identification and characterization of key rangeland species is crucial to any restoration efforts.","Factsheet, Project Note","http://repo.mel.cgiar.org/handle/20.500.11766/10076",
402,1,1900-01-01 00:00:00,2200-01-01 00:00:00,16735,"Impacts of bracteole removal and seeding rate on seedling emergence of halophyte shrubs: implications for rangeland rehabilitation in arid environments. ","we measured the  implications of seed treatment of halophyte shrubs for rangeland rehabilitation in arid environments.","Journal Article (peer reviewed)","http://repo.mel.cgiar.org/handle/20.500.11766/9675",
403,1,1900-01-01 00:00:00,2200-01-01 00:00:00,16740,"Report of on-the-job training on rangelands inventorying and monitoring","On‐the‐job training report during Rangelands Inventorying and Monitoring","Research workshop report","http://repo.mel.cgiar.org/handle/20.500.11766/10155",
404,1,1900-01-01 00:00:00,2200-01-01 00:00:00,16741,"Training materials on rangeland monitoring and assessment","Group Training Course on Rangeland Plant Identification and Vegetation Classification","Lecture/Training Course Material","http://repo.mel.cgiar.org/handle/20.500.11766/10066",
405,1,1900-01-01 00:00:00,2200-01-01 00:00:00,16746,"Community Participation Towards Silvopastoral Restoration","Poster on Community Participation Towards Silvopastoral Restoration: North American Agroforestry conference: Agroforestry for sustainable Production and Resilience Landscape","Presentation/Poster","http://repo.mel.cgiar.org/handle/20.500.11766/10896",
406,1,1900-01-01 00:00:00,2200-01-01 00:00:00,16751,"Silvopastoral Systems and Climate Change Mitigation in Central Tunisia","presentation on Silvopastoral Systems and Climate Change Mitigation in Central Tunisia","Presentation/Poster","http://repo.mel.cgiar.org/handle/20.500.11766/10387",
407,1,1900-01-01 00:00:00,2200-01-01 00:00:00,16756,"Opportunities and constraints in pastoral and agro-pastoral livestock systems: the ICARDA/ILRI experience","Presentation on Opportunities and constraints in pastoral and agro-pastoral livestock systems: the ICARDA/ILRI experience","Presentation/Poster","http://repo.mel.cgiar.org/handle/20.500.11766/10442",
408,1,1900-01-01 00:00:00,2200-01-01 00:00:00,16766,"Innovative application of ICT tools for paperless data capture and feedback in smallholder dairy production systems: The Platform for African Dairy Genetic Gains (ADGG) ","Innovative application of ICT tools for paperless data capture and feedback in smallholder dairy production systems: The Platform for African Dairy Genetic Gains (ADGG) ","Presentation/Poster","https://www.slideshare.net/ILRI/7-aacaa-okeyo-188072702",
409,1,1900-01-01 00:00:00,2200-01-01 00:00:00,17248,"Cash transfers can help Yemen's conflict-affected children","Blog highlights 2 related but separate studies providing evidence that cash-transfers can reduce conflict-driven malnutrition. 1 provided impact evaluation of current Cash-for-Nutrition program of Yemen Social Fund for Development, conducted during civil war. Other presents retrospective analysis of Social Welfare Fund’s unconditional cash-transfer program during a conflict preceding ongoing civil-war.","Blog","http://www.ifpri.org/blog/cash-transfers-can-help-yemens-conflict-affected-children",
410,1,1900-01-01 00:00:00,2200-01-01 00:00:00,18835,"School-on-the-air on Climate-Smart Agriculture (SOA-CSA) in Cagayan Valley","This working paper documents how the ""School-on-the-Air"" approach was used in sharing improved agriculture technologies and support services to a critical mass of farmers affected by climate change.","Discussion paper/Working paper/White paper","https://hdl.handle.net/10568/100482",
411,1,1900-01-01 00:00:00,2200-01-01 00:00:00,18873,"8 Guide steps for setting up a Climate-Smart Village (CSV)","The brief elaborates the 8 steps in setting up a Climate-Smart Village (CSV) in Southeast Asian context.","Policy brief/policy note/briefing paper","https://hdl.handle.net/10568/103527",
412,1,1900-01-01 00:00:00,2200-01-01 00:00:00,18885,"Accessing genetic diversity for food security and climate change adaptation in select communities in Africa.","This book chapter analyses present and future climate‐related challenges addressing communities in Benin, Zambia and Zimbabwe. It summarizes methodologies used to identify climate related changes and determine potentially adaptable material that can be accessed through various access and benefit sharing regimes. ","Book chapter","https://hdl.handle.net/10568/99419 ",
413,1,1900-01-01 00:00:00,2200-01-01 00:00:00,18897,"COMING TOGETHER (Batanai): Learning from Zimbabwe’s experiences with community biodiversity conservation, participatory crop improvement and climate change adaptation.","This brief presents findings and lessons learned of a study tour by a team from the Department of Agriculture, Forestry and Fisheries of South Africa to neighbouring Zimbabwe, to learn about the roles of Farmer Field Schools, functions and operations of community seedbanks and various forms of participatory crop improvement.","Policy brief/policy note/briefing paper","https://hdl.handle.net/10568/101241",
414,1,1900-01-01 00:00:00,2200-01-01 00:00:00,18898,"Green shoots. Community seedbanking in South Africa: endeavours and outcomes 2016-2019","This brief summarizes progress in establishing and supporting a national network of community seedbanks (CSBs) in South Africa in 2016-2019. Three CSBs are up and running. Some exchanges of seeds and knowledge have occurred also with Zimbabwe.  There are plans to bring more diversity to the CSBs to combat drought.","Policy brief/policy note/briefing paper","https://hdl.handle.net/10568/101495",
415,1,1900-01-01 00:00:00,2200-01-01 00:00:00,18899,"Resilient seed systems: handbook. Second edition","This is a tool that supports research and capacity building on resilient seed systems in the context of adaptation to climate change.  It includes steps of a participatory research cycle from situational analysis to knowledge sharing and communication and a new module on seed production and distribution.","Guidebook/Handbook/Good Practice Note","https://hdl.handle.net/10568/103498",
416,1,1900-01-01 00:00:00,2200-01-01 00:00:00,18902,"Healthy food systems require resilient seed systems. Agrobiodiversity Index Report 2019: risk and resilience. ","The Report assesses dimensions of agrobiodiversity in ten countries to measure food system sustainability and resilience. Countries receive an overall Agrobiodiversity Index score that indicates their progress in using and safeguarding agrobiodiversity to create sustainable food systems. This chapter stimulates thinking on resilient seed systems.","Book chapter","https://hdl.handle.net/10568/105871 ",
417,1,1900-01-01 00:00:00,2200-01-01 00:00:00,18903,"Strengthening the community seed banks in South Africa. ","This report describes the main activities carried out in 2018-2019 in establishing and supporting three community seedbanks in South Africa as a means to strengthen farmers’ seed systems, support conservation and sustainable use of traditional farmers’ varieties and maintain seed security .","Funder report","https://hdl.handle.net/10568/105804",
418,1,1900-01-01 00:00:00,2200-01-01 00:00:00,18905,"Strengthening national capacities to implement the International Treaty on Plant Genetic Resources for Food and Agriculture: Project highlights. ","The project ""Strengthening national capacities to implement the Plant Treaty"" (2012 -2016) aimed to: promote the participation of countries in the multilateral system of access and benefit-sharing of the Treaty; identify means to improve countries’ access to PGRFA; and pursue options to benefit from other aspects of the Treaty. ","Policy brief/policy note/briefing paper","https://hdl.handle.net/10568/106023",
419,1,1900-01-01 00:00:00,2200-01-01 00:00:00,18956," Genetic diversity in Napier grass (Cenchrus purpureus) collections as revealed by genotyping by sequencing method of the DArTseq platform"," Genetic diversity in Napier grass (Cenchrus purpureus) collections as revealed by genotyping by sequencing method of the DArTseq platform","Presentation/Poster","https://hdl.handle.net/10568/102347 ",
